,Topic Title,Category,Tags,Authors,Leading Comment,Other Comments
61,How to remove Amazon from listing?,Product Sourcing,"['Product Sourcing', 'Vendor Relations']","['Ivan', 'Mitch', 'Ivan', 'Mitch', 'LizD', 'Ivan']","Hey Guys,  So after a month of negotiations with a brand i finally got exclusivity!!!  So brand has huge problem because Amazon is selling their products and they don’t know how is amazon buying their stuff? and of course amazon as a seller is not follow MAP policy and they would like if i can take control of entire brand on Amazon. This brand has a revenue of around 40,000$ a month.  So my question is how can i stop Amazon of selling their products on brands listings?. Because Brand owners does...","['Hey Guys,\nSo after a month of negotiations with a brand i finally got exclusivity!!!  So brand has huge problem because Amazon is selling their products and they don’t know how is amazon buying their stuff? and of course amazon as a seller is not follow MAP policy and they would like if i can take control of entire brand on Amazon. This brand has a revenue of around 40,000$ a month.\nSo my question is how can i stop Amazon of selling their products on brands listings?. Because Brand owners doesn’t know where is Amazon buying their products from.\nAnd is there any sample of how exclusivity should look like ?\nHope some one know answer !\nThank you !', 'Hi @Ivan.  I’m assuming Amazon’s inventory is listed as new and not damaged product?  Does the brand sell through any distributors?', 'Hey @Mitch\nYes it’s listed as new. And yes Brand is selling tru a lot of distributors. And brand doesn’t  know who is selling to amazon…\nSo they wanna give me exclusivity and to force amazon out of listing .', '@Ivan This is going to be a tall task.  A lot of the work will need to be done on the manufacturers end.  Manufacturer needs to be sure that distributors know not to sell their products to online retailers.  It will still happen but it’s easier to get people off the listing if they were told they can’t sell online.\nAlso special labeling can be used for each distribution channel.  A few months after you have applied the labels, buy from Amazon.  Then see what numbers the product has and you’ll know which distribution channel the product came from.\n@LizD may have some other tricks as well.', 'Some distributors will not cooperate with the brands effectively enough to keep Amazon off the listing. So  the first step should be to determine whether their distributor(s) will.\nWe know brands who have cut off major distributors because they wouldn’t cooperate. Your brand may have to make some tough decisions.\nIf the distributor will cooperate, they should work with the brand to ensure that all buyers know that products may not be sold on Amazon.\nEither way, Amazon often buys under another name. Here are a partial list of Amazon brands, but they may buy under other names as well:\nhttps://www.amazon.com/b?ie=UTF8&node=17602470011](https://www.amazon.com/b?ie=UTF8&node=17602470011&fbclid=IwAR1ADuHuVUsLK9PoifBH74DrlVeChD6vgN4puLGs1mQLkyK9poCWmalcUaw\nMitch has the right idea with the special labeling. If a distributor is cooperating, you are still likely to see people buying products from them and illicitly selling on Amazon. Special labeling (or even marking with a black light pen) will help identify where product is being sourced.\nThere are all sorts of grey market ways Amazon gets their hands on products as well.\nAs for the exclusivity contract, send me an email and I’ll send you a sample template. Thanks!', 'Thank you on such a useful information ! I will send you email.\nRegards,\nIvan']"
62,What do distributors care about?,Product Sourcing,"['Product Sourcing', 'Sourcing Brand Name Products']","['D.Jin', 'LizD', 'Ben', 'D.Jin', 'WillCompere']","Hi,  What do distributors care about in Amazon sellers like us? What is Amazon sellers value prop for distributors beyond the purchase order?  Thanks in advance!  Cheers,  David","['Hi,\nWhat do distributors care about in Amazon sellers like us? What is Amazon sellers value prop for distributors beyond the purchase order?\nThanks in advance!\nCheers,\nDavid', 'The big thing we’ve found distributor sales reps care about is their commission…', 'D.Jin\nMy background is distribution, so hopefully I can give some info.  The questions truly depends on the size of the distributor.  You have distributors that are small and local all the way up to distributors that do 25-100 Billion annually.  Even with that said all distributors are focused on selling product.  Your typical distributor has slim margins, so they want more volume.  The larger distributors the only true value you can add is sales volume.  Unfortunately until your buying big #s that is not a real value prop.   For the smaller distributor you may be able to add value by helping them get sales volume on new items they bring in or slower items they need sales on.  The very very small distributors may need help in other areas, but the med to big ones just want sales in my experience.\nHopefully that helps a bit.', 'Thank you Liz and Ben!', 'Distributors: Care about how deep your pockets are.\nManufacturers: Care about how you will represent their brand and if you will damage the consumers image of the brand. If you can provide value to them.\nAlso…you get a better margin when dealing with manufacturers for the most part.']"
63,How do I analyze a price sheet using PC2?,Product Sourcing,['Product Sourcing'],"['twentyfoursevenagent', 'twentyfoursevenagent', 'LizD']",Hi all. I received a PDF price sheet from a distributor and would like to know how I can use  PC2 to analyze it. I’m not spreadsheet savvy so this is quite foreign to me.  Thanks.,"['Hi all. I received a PDF price sheet from a distributor and would like to know how I can use  PC2 to analyze it. I’m not spreadsheet savvy so this is quite foreign to me.\nThanks.', 'I’ve figured it out. I followed WEBS Sourcing workflow & found a free resource to convert it. Just out now how to make it conform with PC2', 'Glad you found the right WEBS template!']"
64,Sending Gmass Emails,Product Sourcing,['Product Sourcing'],"['EdS', 'Mitch', 'EdS']","How can my VA send emails to distributors and brands, using their assigned Google Suite email address, but show my email as the sender?","['How can my VA send emails to distributors and brands, using their assigned Google Suite email address, but show my email as the sender?', '@EdS I don’t believe you can do that using GMass.  You’d either have to give them access to your email or you can create a suppliers@domain type email to send from.\nIf you want to have VAs send through your account but don’t want to give them your login info, I’d recommend using QuickMail.  It allows you to send emails from several domains and has solid followup capabilities.', 'Thanks @Mitch. I’ll look into QuickMail. For now, I decided to just use delegation.']"
65,Brand Contact Us page,Product Sourcing,['Product Sourcing'],"['BobG', 'Mitch']","Hi there,  I was wondering what approach others use when a Brand has a Contact Us form versus an email address?  Do you submit an inquiry via that method?  If so, how do you track it from a response perspective?  Thanks in advance  Bob Gould  New to WEBS/Flowster","['Hi there,\nI was wondering what approach others use when a Brand has a Contact Us form versus an email address?  Do you submit an inquiry via that method?  If so, how do you track it from a response perspective?\nThanks in advance\nBob Gould\nNew to WEBS/Flowster', '@BobG If the contact us form is your only angle of approach, absolutely submit an inquiry.  Depending on how many contact us forms you are filling out, you may consider tracking them separately from your mass emails.  If only a few, you can use the template for the week in the inquiry and add to your bulk stats.\nThe best option would be to track separately but if you are doing this very rarely, it won’t really affect your stats if you don’t track it as well.  Just depends on how much work you want to put into it.']"
66,Sending Mass email - Gmass,Product Sourcing,['Product Sourcing'],"['xinod14', 'Mitch', 'xinod14', 'xinod14', 'Mitch', 'xinod14', 'Mitch']","Hi!  When you send that mass email to different suppliers using gmass, do you just put all the email address in the “TO” field or “BCC” field?  I don’t want to let the recipient know that I have sent this exact email to hundreds of other people plus the fact that the emails of these people are visible.  On the other hand, if I use “BCC” there is the fear that the email will go into spam folder.  Any tip appreciated.  Thank you!","['Hi!\nWhen you send that mass email to different suppliers using gmass, do you just put all the email address in the “TO” field or “BCC” field?  I don’t want to let the recipient know that I have sent this exact email to hundreds of other people plus the fact that the emails of these people are visible.\nOn the other hand, if I use “BCC” there is the fear that the email will go into spam folder.\nAny tip appreciated.  Thank you!', 'Hi @xinod14\nWhen using GMass, your list should auto-populate in the “TO” field.  Just make sure you are pressing the GMass button when you send and not the send button.  When you click the GMass button, it emails them separately.  If you were to click the send button, it would send email with all addresses CC’d.', 'Thank you for the info @Mitch', 'Do you get a lot of messages not delivered, message blocked, rejected due to spam when sending mass email?  Started sending emails to brands but I get a lot of emails being returned for a bunch of different reasons.  Is this normal? TIA', '@xinod14 You should check your sending reputation.  If it is poor, you will be sent to the spam folder more often.  It is also recommended that you verify your emails before you send them.  We use Neverbounce to do this.  Having high bounce rates will lower your sending reputation.', 'Thank you for the tip Mitch! Will try Neverbounce asap', '@xinod14 You’re welcome! Hope that increases your deliverability!']"
67,WEBS Strikes Again!,Product Sourcing,['Product Sourcing'],"['Trent-Admin', 'WillCompere', 'LizD', 'Randall', 'LizD', 'Randall']","Here’s yet another huge new opportunity from the outbound email campaigns that we are able to easily do with WEBS.  I’m particularly excited to see that they spoke with 3 other companies, and we are the only one they are considering. This is the kind of thing that happens when you’ve done your homework and are prepared for the call (WEBS covers this)     This account will be worth north of $10K/mo in gross profit.  Happy to answer any questions you have.","['Here’s yet another huge new opportunity from the outbound email campaigns that we are able to easily do with WEBS.\nI’m particularly excited to see that they spoke with 3 other companies, and we are the only one they are considering. This is the kind of thing that happens when you’ve done your homework and are prepared for the call (WEBS covers this)\n\nHuge_New_Brand.jpg959×516 145 KB\n\nThis account will be worth north of $10K/mo in gross profit.\nHappy to answer any questions you have.', 'I love this! That’s so exciting Trent! I can’t wait to be in similar positions😁! One question I have, I know Warren Carter was using a “brand health review” that he emails brands that shows them what is being done poorly with their listing etc. does your company do something similar? If so, what’s the best formatting/layout for this that conveys a sense of urgency the best? Is there a software or something that allows you to do this easily? @Trent-Admin', 'We have a template in WEBS for our VAs to prepare a report for a brand. We find it effective to compare & contrast their listings, PPC, sales, etc with some of their competitors.', 'Could we get the explicit WEBS folder and template title for that report?  Thanks.', 'SOURCING: Brand Pre-Call Research', 'LizD:\n\nBrand Pre-Call Research\n\n\nGot it, thanks!']"
68,VA Scouting Expectation,Product Sourcing,['Product Sourcing'],"['WillCompere', 'LizD', 'WillCompere', 'LizD']","Hey everyone! What expectations should I have for my VAs in regard to how long it should take them to find x number of leads? Say 100 for example. I want to get a baseline for what work speeds I should consider medium, good, excellent etc. What is the speed at which your VAs are able to accrue a good list of leads?","['Hey everyone! What expectations should I have for my VAs in regard to how long it should take them to find x number of leads? Say 100 for example. I want to get a baseline for what work speeds I should consider medium, good, excellent etc. What is the speed at which your VAs are able to accrue a good list of leads?', 'It depends a lot on exactly how you’re filtering for leads, and on how new you are. Our VAs sometimes only get 2-8 leads/hour worked… but that includes extraction time and finding high quality email addresses (not just info@).\nWe also used to get more per hour… but a few years in and we end up finding a number of companies that we already have emailed.', 'Interesting. How many hours a week does your sourcing VA/VAs work? And how many leads do they normally extract? From finding the product to  finding brand email etc. the whole process.', 'We always have multiple VAs and most work 40 hours/week. Extracted leads varies wildly depending on the seller extracting… sometimes there are none left after filtering, sometimes hundreds.']"
69,Amazon,Product Sourcing,"['Product Sourcing', 'Vendor Management']","['Ketsaal', 'Mitch']",Is that good for the Seller to stick on the oneplatform for business promotion and Sales?,"['Is that good for the Seller to stick on the oneplatform for business promotion and Sales?', '@Ketsaal Are you asking whether you should move to selling on other platforms along with Amazon?  It is a good selling point to brands if you have the ability to move products off Amazon as well as on.']"
70,WEBS: How do I buy WEBS? (I want to Pay Full amount right away),Product Sourcing,"['Product Sourcing', 'Sourcing Brand Name Products']","['uncleusa', 'LizD', 'Mac', 'Trent-Admin']",WEBS:  How do I buy WEBS?  (I want to Pay Full amount right away)  Thanks  Shawn Chhabra,"['WEBS:\nHow do I buy WEBS?  (I want to Pay Full amount right away)\nThanks\nShawn Chhabra', 'Check out the resources page on Bright Ideas: https://brightideas.co/resources/', 'Do we get a credit against the the beginner package when we buy the full WEBS package?', 'Yes, you do. After you make your purchase of WEBS, simply contact support@brightideas.co with your request for the refund of the beginner package.']"
71,Winning new accounts using trade shows,Product Sourcing,['Product Sourcing'],['Trent-Admin'],"Epic day today. We won a new account worth $10K+/mo in gross profit. Only took me two years from the first time I spoke with them until now.  Got a “we are definitely doing business together. I’m firing 2 of my 4 sellers and adding you as soon as they sell through” from another account that should be worth $50K to $80K/mo in revenue.  I also have at least 10 really solid leads and I expect to win 2-3 of them at a minimum. Another 20 leads that will need nurturing.  If I had to guess, within 90 d...","['Epic day today. We won a new account worth $10K+/mo in gross profit. Only took me two years from the first time I spoke with them until now.\nGot a “we are definitely doing business together. I’m firing 2 of my 4 sellers and adding you as soon as they sell through” from another account that should be worth $50K to $80K/mo in revenue.\nI also have at least 10 really solid leads and I expect to win 2-3 of them at a minimum. Another 20 leads that will need nurturing.\nIf I had to guess, within 90 days, our revenue will be up over $100K/mo.\nHere’s a few take aways from my time at the conference over the last few days:\n\nStrong selling brands get pitched far more than you can imagine\nSome sellers even offer bribes ($10K cash under the table) to get account approval (didn’t work)\nEveryone’s pitch sounds the same (we’ll help you remove unauthorized sellers and increase sales)\n\nSo how do you break through?\n\nRapport is the key to creating opportunities and winning accounts. If they don’t like/trust you, you have no chance in hell.\nContent plays a role in building trust. Your smile plays a role in generating rapport.\nBe persistent. (email & the phone is great for this)\nGo after brands that aren’t yet on everybody’s radar screen. Look for brands that are the up and comers.\nDO YOUR HOMEWORK AND KNOW WTF YOU ARE TALKING ABOUT.\n\nThere is a MOUNTAIN of opportunity in wholesale. There is a never ending supply of new brands. You simply have to hustle your ass off to get/keep them, and to do that, you have to want it REALLY BAD.\nIf you aren’t bringing your A-game, don’t bother even trying. You will get beat (every time) by those that did bring their A-game.']"
72,Product Sourcing for Professionals,Product Sourcing,['Product Sourcing'],"['Emuran', 'Trent-Admin', 'Josie', 'Kane']","RE: the Product Sourcing for Professionals $397 Offer posted this past weekend, we signed up and I’m wondering, since we bought the Professional Package will our credit card be credited back the $397? Also when will we start to be able to view the 3 Videos on Modules covering: Product Discovery, Product Extraction & Product Purchasing going over the 37 steps you take before you send a purchase order to a new supplier to minimize risk of bad investment. Also, when is the next advanced sales call ...","['RE: the Product Sourcing for Professionals $397 Offer posted this past weekend, we signed up and I’m wondering, since we bought the Professional Package will our credit card be credited back the $397? Also when will we start to be able to view the 3 Videos on Modules covering: Product Discovery, Product Extraction & Product Purchasing going over the 37 steps you take before you send a purchase order to a new supplier to minimize risk of bad investment. Also, when is the next advanced sales call since that is also included? Thank you so much and we look forward to your reply(ies).', 'Welcome to the forum. We have refunded the charge of $397 because you already own the full version of WEBS so there was no need to purchase this version. See you on the next WEBS customer call!', 'Hi, Trent. I bought the Product Sourcing for Professionals, and I received the link to the forum, but none of the other promised materials. I suspect that I just don’t know where to look. I tried contacting customer service and was channelled to Facebook and left a message there, but received no response. Can you help me?', ""Hi @Josie!\nThere’s usually two common issues:\n\n\nYou signed up to Flowster with a different email than you bought Product Sourcing for Professionals with.\n\n\nYou haven’t upgraded to the Standard plan: https://in.flowster.app/upgrade/account\n(since Product Sourcing for Professionals contains 7 templates and the Free plan can only accommodate 5)\n\n\nIf it’s neither of those things, please contact us at Flowster Support and we’ll be able to help further \n\n\n\nFlowster – 10 Aug 18\n\n\n\nContact Us | Flowster\nHow can we help you? Feel free to contact us if you have any questions Get In Touch Flowster 223 NV-207 #4225 Stateline, NV 89449-4225 USA E: support@flowster.app P: +1 619.721.3220 Support We're""]"
73,Existing Ads?,Product Sourcing,"['Product Sourcing', 'Vendor Relations']","['APlusSeller', 'Mitch']",How do I tell if other sellers on the listing are currently running ads?,"['How do I tell if other sellers on the listing are currently running ads?', '@APlusSeller One easy way to find out is to run a search for the brand name.  Typically, listings will show up in the sponsored product area if ads are being run.\nIf you are trying to find if a specific listing is being advertised, and it didn’t show up as a sponsored product in the brand search, you will have to run some searches using keywords from the listing.  This doesn’t guarantee you will get an answer though as they may not be winning they keyword(s) at the moment.\nAlso, if you do an extraction on the storefront using Jungle Scout, a little SP will show up beside the line on the extraction if ads are being run on the listing.  I believe it may only do this for the sponsored products on the page though so it may be redundant information.']"
74,Email sourcing SOP missing?,Product Sourcing,['Product Sourcing'],"['Wayne', 'Mitch', 'Wayne', 'Mitch', 'Wayne', 'Mitch']",Under LEAF PRODUCT SOURCING: Step 2: Product Extractions with Tactical Arbitrage - Step 9 (Copy data to Google Spreadsheet)   We’re instructed to populate the Google URL column as it’s going to be used for the import step (Step3 of the Email Sourcing Process)  I can’t seem to find the SOP for the Email Sourcing process or is it referring to the following SOP?  SOURCING: Step 3: Importing Leads into HubSpot,"['Under LEAF PRODUCT SOURCING: Step 2: Product Extractions with Tactical Arbitrage - Step 9 (Copy data to Google Spreadsheet)\n\nWe’re instructed to populate the Google URL column as it’s going to be used for the import step (Step3 of the Email Sourcing Process)\n\nI can’t seem to find the SOP for the Email Sourcing process or is it referring to the following SOP?\nSOURCING: Step 3: Importing Leads into HubSpot', '@Wayne are you asking about the SOP that walks you through sending the actual emails?\nStep 2 walks you through finding leads, step 3 walks you through bringing the leads into Hubspot and step 4 tells you how to send the emails.\nDoes this answer your question?', '@Mitch  This is directly from the SOP for Step 2 (Product Extraction)\n\nPopulate Google Sheet URL\nThe final step is to copy and paste the Google Sheet URL into the column titled Google Sheet URL .\nYou can use Bit.ly for this step. This should be the link to the Product Extraction WEBS Spreadsheet .\nWe use this for the import step (Step 3 of the Email Sourcing Process). It will import into Hubspot later on. This allows us to easily locate the initial Product Extraction data while following up with the brand.\n\nI can not find any SOP titled Email Sourcing', '@Wayne All of the steps are part of the email sourcing process.  If you are talking about the SOP that actually shows you how to send the emails, then you are looking for step 4.\nSourcing____Folder____Flowster.png907×302 46.5 KB\n\nYou can also reference the sourcing overview to see how the process all fits together.', 'Thank you for the clarification', 'Your welcome @Wayne.  By the way, what do you love about WEBS?  We’d love to hear it.  Please post to our Amazon Wholesale Success Facebook group and let others know about your journey.']"
