,Topic Title,Category,Tags,Authors,Leading Comment,Other Comments
41,Returned item without reason described?,Amazon Specific,Amazon Specific,zaid,I heard that Amazon had a policy update where customers would be required to enter a reason for why they’re returning an item.  However we’re still getting the occasional return where there’s no reason listed.  Does anyone have any news on this?,"
I heard that Amazon had a policy update where customers would be required to enter a reason for why they’re returning an item.
However we’re still getting the occasional return where there’s no reason listed.
Does anyone have any news on this?
"
42,"Amazon sellers say online retail giant is trying to help itself, not consumers",Amazon Specific,Amazon Specific,Trent-Admin,"Just ran across this article and wanted to share it. If you have thoughts or comments, leave them below.","
Just ran across this article and wanted to share it. If you have thoughts or comments, leave them below.
"
43,Brand health - Question about optimized search terms,Amazon Specific,Amazon Specific,liahsidney,"Received notification that 1 or 2 of my listings are “high risk” and recommendations are ""not optimized. This is in the Brand Health, in the Optimized Search Terms page. I wanted to know what that “high risk” tag meant. I hope someone can help.","
Received notification that 1 or 2 of my listings are “high risk” and recommendations are ""not optimized. This is in the Brand Health, in the Optimized Search Terms page. I wanted to know what that “high risk” tag meant. I hope someone can help.
"
44,Amazon Product Listing Removed,Amazon Specific,Amazon Specific,D.Jin,"Hi,  One of my products has been removed. I reached out to AmZ support and the product was removed as the product does not respect the intellectual property rights of others. Your listings might be using the trademark “brand x” incorrectly.  My product is to be used with brand x. Brand x’s name was on the listing. I believe because it had the brand’s name, it was removed.  Can you please advise what would be the best way to reinstate the product?  Cheers,  David","
Hi,
One of my products has been removed. I reached out to AmZ support and the product was removed as the product does not respect the intellectual property rights of others. Your listings might be using the trademark “brand x” incorrectly.
My product is to be used with brand x. Brand x’s name was on the listing. I believe because it had the brand’s name, it was removed.
Can you please advise what would be the best way to reinstate the product?
Cheers,
David
"
45,Wholesale VS Agency business model?,Amazon Specific,Amazon Specific,gianmeliShanghai,"Hello,  This question is directly related to @Trent_Dyrsmid  business model (hope Trent or anyone that has a good answer can reply to this).  When pitching my company business model to other entrepreneurs, specifically referring to the wholesale model that focus on closing special agreements with brands to have exclusive distribution on Amazon, I always get asked whether what I provide is a service or not.  I initially thought it was not but then I realized that working on the same offer but pro...","
Hello,
This question is directly related to @Trent_Dyrsmid  business model (hope Trent or anyone that has a good answer can reply to this).
When pitching my company business model to other entrepreneurs, specifically referring to the wholesale model that focus on closing special agreements with brands to have exclusive distribution on Amazon, I always get asked whether what I provide is a service or not.
I initially thought it was not but then I realized that working on the same offer but providing it  as a service might be convenient under certain aspects.
In the “traditional” wholesale model, my company would first close an agreement for the exclusivity to be the only seller of those products on Amazon, then I would periodically buy the products from the brand and do as much as I can to improve sales because it will benefit me (improve pics, listing and invest in ppc)
On the other hand, if I would give the same kind of offer to the brand, but offering it as a service, I would manage their Amazon account (still being the only seller as I would represent the brand itself) but this time I won’t need to purchase any stock in advance (as the brand would provide them), and I will not need to invest in any optimization as it’s their account so I can offer that to them as a service. In terms of payment then I would just get a commission out of sales but without advancing any stock.
I see in the service case (so essentially providing Amazon account management) similar upsides to the “traditional” model (eg. exclusivity) but less downsize (eg. no need to purchase stock in advance)
What are your thoughts about this? Am I missing anything?
My other biggest concern in the “traditional” model is: how do you make sure that the brand won’t end the exclusivity agreement after you have built BSR for their products and invested in PPC and listing optimization?
Or what can you do to minimize that risk?
Thanks in advance
"
46,Profit First- Inventory,Amazon Specific,Amazon Specific,BetterLifeSales,When doing the profit-first model and trying to find your COGS amount. Are we finding the COGS from the two-week prior to the date you received your Amazon payment? Or are you finding the COGS of the two weeks from which that payment came from? For the second way how do find that out?,"
When doing the profit-first model and trying to find your COGS amount. Are we finding the COGS from the two-week prior to the date you received your Amazon payment? Or are you finding the COGS of the two weeks from which that payment came from? For the second way how do find that out?
"
47,How to sell a lead on the idea of product reviews = more sales,Amazon Specific,Amazon Specific,dast1983,"Hey -  So I have a lead I want to approach with the idea of creating automated emails using Feedback Genius to increase their product sales. They’re going to list some items on Amazon, but I don’t think they realize how long it can take to get enough reviews to get their sales flowing.  I want to set up automated emails, customize them to the product, and create a PDF to drive their review rate up to 6-7% using Feedback Genius. I haven’t done this with new listings before, so I’m trying to figur...","
Hey -
So I have a lead I want to approach with the idea of creating automated emails using Feedback Genius to increase their product sales. They’re going to list some items on Amazon, but I don’t think they realize how long it can take to get enough reviews to get their sales flowing.
I want to set up automated emails, customize them to the product, and create a PDF to drive their review rate up to 6-7% using Feedback Genius. I haven’t done this with new listings before, so I’m trying to figure out how to discuss this so it’s set up for win-win from the start.
I’d also offer to monitor and respond to negative reviews for them.
Anywho, I’m thinking of telling them they’ll get a much slower rate of reviews without using automated emails or a PDF, which means if I add those two types of value for them, that will shorten their time to grow sales significantly. And the same with responding to the negative product reviews.
So, do I tell them I expect about a .5% review rate without any emails sent, 2% with a custom email sent, and about 6% if we advertise a bonus PDF? And then hold myself accountable for showing them those metrics with Feedback Genius.
And if they’re convinced, only after they see that value would I ask them to sign a contract.
It’s scary. Haven’t done this before. Just know it works.
Interested in your advice,
Dan
"
48,"""4 stars and above"" Sponsored Ads?",Amazon Specific,Amazon Specific,jims,Does anyone know how to target this “4 stars and above” ad block on a product listing page?     You can see it here:  https://www.amazon.com/dp/B06XXXQVNZ/,"
Does anyone know how to target this “4 stars and above” ad block on a product listing page?

Selection_686.png1919×920 476 KB

You can see it here:
https://www.amazon.com/dp/B06XXXQVNZ/
"
49,Brand Registry,Amazon Specific,Amazon Specific,VonT,Does being brand registered help when you are selling wholesale? Or does it only help when you are selling Private label?,"
Does being brand registered help when you are selling wholesale? Or does it only help when you are selling Private label?
"
50,What software do you use to help optimize Amazon Sponsored Products ads?,Amazon Specific,Amazon Specific,jims,I’ve been using some of Viral Launch’s tools. Are there any other good ones out there?,"
I’ve been using some of Viral Launch’s tools. Are there any other good ones out there?
"
51,About the Product Sourcing Category,Product Sourcing,Product Sourcing,Trent-Admin,Have questions about sourcing products? This is the category to use. Please be sure to select the most appropriate sub-category for your questions.,"
Have questions about sourcing products? This is the category to use. Please be sure to select the most appropriate sub-category for your questions.
"
52,Top 10 Tips to Grow your Business Rapidly,Product Sourcing,Product Sourcing,Pradimna_Kumar,"As I am working in Amazon as a seller from last 6 years do you want some tips for selling and growing your business fastly like how I grow my business this are some tips, please read carefully :-  Top 10 Amazon Selling Tips    Optimize Product Details for Search    Use Competitive Pricing    Take Professional Product Images    Try to Own the Buy Box    Work to Continually Improve Your Performance    Consider Using Fulfillment by Amazon    Follow Amazon’s Rules    Leverage Product Reviews to Your...","
As I am working in Amazon as a seller from last 6 years do you want some tips for selling and growing your business fastly like how I grow my business this are some tips, please read carefully :-
Top 10 Amazon Selling Tips


Optimize Product Details for Search


Use Competitive Pricing


Take Professional Product Images


Try to Own the Buy Box


Work to Continually Improve Your Performance


Consider Using Fulfillment by Amazon


Follow Amazon’s Rules


Leverage Product Reviews to Your Advantage


Make Customer Service a Top Priority


Manage Amazon Inventory Proactively


"
53,Virtual Assistants,Product Sourcing,Product Sourcing,McDavid,"Does anyone have a VA they recommend, have used or currently using that require more work?","
Does anyone have a VA they recommend, have used or currently using that require more work?
"
54,Can you sell branded products on Amazon uk,Product Sourcing,Product Sourcing,Rameksuya,Can you sell branded products on Amazon Uk or must it be in Amazon .com,"
Can you sell branded products on Amazon Uk or must it be in Amazon .com
"
55,Price Checker Sales Estimate,Product Sourcing,Product Sourcing,xinod14,"Hi!  Are y’all still using PC2 for extracting storefront?  Looks like their numbers are way off (Est. monthly sales) and if we base our research on these #s then we are looking at incorrect info?!  I’ve tried running Helium & JS and their estimates are close to each other, PC2 is just way off.  So if our assumption of monthly share volume is based on that, we could be considering carrying a product that is a dud.","
Hi!
Are y’all still using PC2 for extracting storefront?  Looks like their numbers are way off (Est. monthly sales) and if we base our research on these #s then we are looking at incorrect info?!  I’ve tried running Helium & JS and their estimates are close to each other, PC2 is just way off.
So if our assumption of monthly share volume is based on that, we could be considering carrying a product that is a dud.
"
56,Black Box (Amazon Product Research) - yay or nay?,Product Sourcing,Product Sourcing,zaid,"We’ve heard some good things about this tool:      Just wondering if other people are using it, and what your experiences are?","
We’ve heard some good things about this tool:



pages.helium10.com



Black Box - Amazon Product Finder & Research Tool | Helium 10
Black Box, gives Amazon sellers the power to find virtually any type of product they may want to sell on Amazon based on the criteria set.






Just wondering if other people are using it, and what your experiences are?
"
57,VA's vs Outbound Call Center,Product Sourcing,Product Sourcing,Daniel_Folkmanas,"Anyone have experienced using an Outbound call center to close new leads instead of VA’s? With closing new deals I mean calling, email, filling the forms online.Thanks!","
Anyone have experienced using an Outbound call center to close new leads instead of VA’s? With closing new deals I mean calling, email, filling the forms online.Thanks!
"
58,BO's Contact Info Research Linkedin paid account VA access,Product Sourcing,Product Sourcing,Cameron.B,"Hello all, I was hesitant to let my VA sign into my personal linkedin profile to use linkedin professional business to search for contact information.  So, I created a new personal linkedin profile to connect my company page. Linkedin will not let you create a company page with a separate login. Now, I find that even with linkedin professional business (unlimited 3rd degree searching) I’m still getting blocked from doing three degrees of separation searching, because my second profile only has a...","
Hello all, I was hesitant to let my VA sign into my personal linkedin profile to use linkedin professional business to search for contact information.
So, I created a new personal linkedin profile to connect my company page. Linkedin will not let you create a company page with a separate login. Now, I find that even with linkedin professional business (unlimited 3rd degree searching) I’m still getting blocked from doing three degrees of separation searching, because my second profile only has a couple connections.
Did anyone else feel a little uneasy with handing over your personal linkedin page to your VA to gather email info?
Thoughts…?
"
59,Catalogs Analysis Best Practices,Product Sourcing,Product Sourcing,gianmeliShanghai,"Hello all, I found it’s a very lenghty process to go through catalogs and choosing the right products to order. I found my self also going through the same products multiple times to double check prices, competition, etc.  Do you have any best practices and tips to recommend to go through a catalog?  For example, analyzing a TA or ScanUnlimited catalog, do you add colums, filters or format things differently in order to be more efficient in analyzing the catalog?  Thank you!","
Hello all, I found it’s a very lenghty process to go through catalogs and choosing the right products to order. I found my self also going through the same products multiple times to double check prices, competition, etc.
Do you have any best practices and tips to recommend to go through a catalog?
For example, analyzing a TA or ScanUnlimited catalog, do you add colums, filters or format things differently in order to be more efficient in analyzing the catalog?
Thank you!
"
60,Selling books,Product Sourcing,Product Sourcing,Dennis_Scheurich,"my question is : when selling books, the pricing for paperback books is for some reason a lot lower than the mass market prices even though the mass market books are supposedly of lesser quality. why is this ?","
my question is : when selling books, the pricing for paperback books is for some reason a lot lower than the mass market prices even though the mass market books are supposedly of lesser quality. why is this ?
"
61,How to remove Amazon from listing?,Product Sourcing,Product Sourcing,Ivan,"Hey Guys,  So after a month of negotiations with a brand i finally got exclusivity!!!  So brand has huge problem because Amazon is selling their products and they don’t know how is amazon buying their stuff? and of course amazon as a seller is not follow MAP policy and they would like if i can take control of entire brand on Amazon. This brand has a revenue of around 40,000$ a month.  So my question is how can i stop Amazon of selling their products on brands listings?. Because Brand owners does...","
Hey Guys,
So after a month of negotiations with a brand i finally got exclusivity!!!  So brand has huge problem because Amazon is selling their products and they don’t know how is amazon buying their stuff? and of course amazon as a seller is not follow MAP policy and they would like if i can take control of entire brand on Amazon. This brand has a revenue of around 40,000$ a month.
So my question is how can i stop Amazon of selling their products on brands listings?. Because Brand owners doesn’t know where is Amazon buying their products from.
And is there any sample of how exclusivity should look like ?
Hope some one know answer !
Thank you ! 
"
62,What do distributors care about?,Product Sourcing,Product Sourcing,D.Jin,"Hi,  What do distributors care about in Amazon sellers like us? What is Amazon sellers value prop for distributors beyond the purchase order?  Thanks in advance!  Cheers,  David","
Hi,
What do distributors care about in Amazon sellers like us? What is Amazon sellers value prop for distributors beyond the purchase order?
Thanks in advance!
Cheers,
David
"
63,How do I analyze a price sheet using PC2?,Product Sourcing,Product Sourcing,twentyfoursevenagent,Hi all. I received a PDF price sheet from a distributor and would like to know how I can use  PC2 to analyze it. I’m not spreadsheet savvy so this is quite foreign to me.  Thanks.,"
Hi all. I received a PDF price sheet from a distributor and would like to know how I can use  PC2 to analyze it. I’m not spreadsheet savvy so this is quite foreign to me.
Thanks.
"
64,Sending Gmass Emails,Product Sourcing,Product Sourcing,EdS,"How can my VA send emails to distributors and brands, using their assigned Google Suite email address, but show my email as the sender?","
How can my VA send emails to distributors and brands, using their assigned Google Suite email address, but show my email as the sender?
"
65,Brand Contact Us page,Product Sourcing,Product Sourcing,BobG,"Hi there,  I was wondering what approach others use when a Brand has a Contact Us form versus an email address?  Do you submit an inquiry via that method?  If so, how do you track it from a response perspective?  Thanks in advance  Bob Gould  New to WEBS/Flowster","
Hi there,
I was wondering what approach others use when a Brand has a Contact Us form versus an email address?  Do you submit an inquiry via that method?  If so, how do you track it from a response perspective?
Thanks in advance
Bob Gould
New to WEBS/Flowster
"
66,Sending Mass email - Gmass,Product Sourcing,Product Sourcing,xinod14,"Hi!  When you send that mass email to different suppliers using gmass, do you just put all the email address in the “TO” field or “BCC” field?  I don’t want to let the recipient know that I have sent this exact email to hundreds of other people plus the fact that the emails of these people are visible.  On the other hand, if I use “BCC” there is the fear that the email will go into spam folder.  Any tip appreciated.  Thank you!","
Hi!
When you send that mass email to different suppliers using gmass, do you just put all the email address in the “TO” field or “BCC” field?  I don’t want to let the recipient know that I have sent this exact email to hundreds of other people plus the fact that the emails of these people are visible.
On the other hand, if I use “BCC” there is the fear that the email will go into spam folder.
Any tip appreciated.  Thank you!
"
67,WEBS Strikes Again!,Product Sourcing,Product Sourcing,Trent-Admin,"Here’s yet another huge new opportunity from the outbound email campaigns that we are able to easily do with WEBS.  I’m particularly excited to see that they spoke with 3 other companies, and we are the only one they are considering. This is the kind of thing that happens when you’ve done your homework and are prepared for the call (WEBS covers this)     This account will be worth north of $10K/mo in gross profit.  Happy to answer any questions you have.","
Here’s yet another huge new opportunity from the outbound email campaigns that we are able to easily do with WEBS.
I’m particularly excited to see that they spoke with 3 other companies, and we are the only one they are considering. This is the kind of thing that happens when you’ve done your homework and are prepared for the call (WEBS covers this)

Huge_New_Brand.jpg959×516 145 KB

This account will be worth north of $10K/mo in gross profit.
Happy to answer any questions you have.
"
68,VA Scouting Expectation,Product Sourcing,Product Sourcing,WillCompere,"Hey everyone! What expectations should I have for my VAs in regard to how long it should take them to find x number of leads? Say 100 for example. I want to get a baseline for what work speeds I should consider medium, good, excellent etc. What is the speed at which your VAs are able to accrue a good list of leads?","
Hey everyone! What expectations should I have for my VAs in regard to how long it should take them to find x number of leads? Say 100 for example. I want to get a baseline for what work speeds I should consider medium, good, excellent etc. What is the speed at which your VAs are able to accrue a good list of leads?
"
69,Amazon,Product Sourcing,Product Sourcing,Ketsaal,Is that good for the Seller to stick on the oneplatform for business promotion and Sales?,"
Is that good for the Seller to stick on the oneplatform for business promotion and Sales?
"
70,WEBS: How do I buy WEBS? (I want to Pay Full amount right away),Product Sourcing,Product Sourcing,uncleusa,WEBS:  How do I buy WEBS?  (I want to Pay Full amount right away)  Thanks  Shawn Chhabra,"
WEBS:
How do I buy WEBS?  (I want to Pay Full amount right away)
Thanks
Shawn Chhabra
"
71,Winning new accounts using trade shows,Product Sourcing,Product Sourcing,Trent-Admin,"Epic day today. We won a new account worth $10K+/mo in gross profit. Only took me two years from the first time I spoke with them until now.  Got a “we are definitely doing business together. I’m firing 2 of my 4 sellers and adding you as soon as they sell through” from another account that should be worth $50K to $80K/mo in revenue.  I also have at least 10 really solid leads and I expect to win 2-3 of them at a minimum. Another 20 leads that will need nurturing.  If I had to guess, within 90 d...","
Epic day today. We won a new account worth $10K+/mo in gross profit. Only took me two years from the first time I spoke with them until now.
Got a “we are definitely doing business together. I’m firing 2 of my 4 sellers and adding you as soon as they sell through” from another account that should be worth $50K to $80K/mo in revenue.
I also have at least 10 really solid leads and I expect to win 2-3 of them at a minimum. Another 20 leads that will need nurturing.
If I had to guess, within 90 days, our revenue will be up over $100K/mo.
Here’s a few take aways from my time at the conference over the last few days:

Strong selling brands get pitched far more than you can imagine
Some sellers even offer bribes ($10K cash under the table) to get account approval (didn’t work)
Everyone’s pitch sounds the same (we’ll help you remove unauthorized sellers and increase sales)

So how do you break through?

Rapport is the key to creating opportunities and winning accounts. If they don’t like/trust you, you have no chance in hell.
Content plays a role in building trust. Your smile plays a role in generating rapport.
Be persistent. (email & the phone is great for this)
Go after brands that aren’t yet on everybody’s radar screen. Look for brands that are the up and comers.
DO YOUR HOMEWORK AND KNOW WTF YOU ARE TALKING ABOUT.

There is a MOUNTAIN of opportunity in wholesale. There is a never ending supply of new brands. You simply have to hustle your ass off to get/keep them, and to do that, you have to want it REALLY BAD.
If you aren’t bringing your A-game, don’t bother even trying. You will get beat (every time) by those that did bring their A-game.
"
72,Product Sourcing for Professionals,Product Sourcing,Product Sourcing,Emuran,"RE: the Product Sourcing for Professionals $397 Offer posted this past weekend, we signed up and I’m wondering, since we bought the Professional Package will our credit card be credited back the $397? Also when will we start to be able to view the 3 Videos on Modules covering: Product Discovery, Product Extraction & Product Purchasing going over the 37 steps you take before you send a purchase order to a new supplier to minimize risk of bad investment. Also, when is the next advanced sales call ...","
RE: the Product Sourcing for Professionals $397 Offer posted this past weekend, we signed up and I’m wondering, since we bought the Professional Package will our credit card be credited back the $397? Also when will we start to be able to view the 3 Videos on Modules covering: Product Discovery, Product Extraction & Product Purchasing going over the 37 steps you take before you send a purchase order to a new supplier to minimize risk of bad investment. Also, when is the next advanced sales call since that is also included? Thank you so much and we look forward to your reply(ies).
"
73,Existing Ads?,Product Sourcing,Product Sourcing,APlusSeller,How do I tell if other sellers on the listing are currently running ads?,"
How do I tell if other sellers on the listing are currently running ads?
"
