,Topic Title,Category,Tags,Authors,Leading Comment,Other Comments
117,What email marketing tool(s) do you recommend?,Traffic Sources,"['Traffic Sources', 'Email Marketing']","['Kane', 'Mitch', 'Dwtarbe', 'philg', 'Mitch', 'BigLoo', 'Mitch', 'BigLoo']",There’s so many of them out there … which ones do you like and why?,"['There’s so many of them out there … which ones do you like and why?', 'Hi @Kane,\nGMass has great ease of use, deliverability, and stats reporting.  We’ve also tried Quickmail and Snov.io.  Quickmail’s automated followups are fantastic.  I couldn’t get Snov.io to work well at all for me but the conditional sequencing it boasts has a lot of potential.\nI’d really like an email marketing tool that has the ability to build great followup sequences but can pick up email domains. By that I mean if I send an email to John@abc.com but get a response from Ann@abc.com, I don’t want a followup to be sent to John again.\nDoes anyone know of an email marketing tool with this capability?', 'Use nethunt. Integrates with gsuite account. Can stay in gsuite account and put in stages in nethunt.  Easier than HubSpot to set up. Train my va to send template emails in net hunt and made my life so much easier. Only respond to emails that need my attention. When using gmass had 15% emails did not go through. Using nethunt probably under 5% maybe lower. Big fan of nethunt in my business.', 'Does Nethunt have followup capabiliies similar to GMass?\nThanks,\nPhil', '@Dwtarbe That sounds great.  I’ll look into it.', 'As for my favorite email marketing tools, I often use eSputnik and Mailchimp to promote my E-commerce projects. Both seem easy to use and offer different great free options.\nIn the case of Mailchimp it is 12000 emails you can send per month in the trial version. Also I like its drag&drop editor containing various blocks for different purposes. But the main disadvantage is the absence of “Undo” button for every editing option. Anyway, I really like this user-friendly design.\nAs for eSputnik, you can order for free the development of 1 email template for your website and send 2500 letters and 10 SMS using your free plan. Here is a piece of an email template developed by eSputnik team especially for my website:\n\nnewsletter620×608 95.6 KB\n\nLooks cool, especially given that it was free. So, this is a really interesting feature.\nAnd speaking of cons, you can’t use mouse to stretch or narrow email blocks in the editor. Fortunately, there are “+” and “-” buttons to do it fast.\nHope my answer will be useful.', 'Thanks @BigLoo.  That email template looks real nice!  What do you prefer out of the two?  I believe we have experimented with Mailchimp in the past.', 'Mitch:\n\nThat email template looks real nice! What do you prefer out of the two?\n\n\nThank you! I would recommend to try both tools to find most appropriate for your purposes. Both platforms contain interesting features and different free plans. So, it depends on your personal preferences.']"
118,Generate traffic to product listings,Traffic Sources,"['Traffic Sources', 'All Other Traffic Sources']","['Trent-Admin', 'MBahe', 'KeithH']",What are some low cost and effective ways to drive traffic to my product listings? Have you had success with Facebook groups? Instagram? Youtube? Forums?,"['What are some low cost and effective ways to drive traffic to my product listings? Have you had success with Facebook groups? Instagram? Youtube? Forums?', 'Assuming you are competing with another FBA seller or two - If you have an existing audience (FB Page, FB Group, Email list, etc), is there a way to use something like a super URL to make it so that people who purchase are buying your products versus those of the competitor?', 'I would think the link tied to your storefront (similar to when you click through on sellers storefront) would do the trick as it only shows your item.']"
119,How does dynamic bidding change your add position?,Traffic Sources,"['Traffic Sources', 'PPC']","['Janeen', 'Laura']",How does dynamic bidding change your add position?,"['How does dynamic bidding change your add position?', 'Dynamic bidding is a new tool in Amazon that can really change your spend. This is a tool that will be able to change your bids per keyword based on how likely your product is to convert (or has historically converted in the past).\nThis is a tool you want to only use for existing PPC campaigns on Amazon. Using it for a new campaign will only cause you to spend significantly.']"
120,About the Management category,Management,['Management'],['Kane'],Have questions about Management? This is the category to use. Please be sure to select the most appropriate sub-category for your questions.,['Have questions about Management? This is the category to use. Please be sure to select the most appropriate sub-category for your questions.']
121,Cheapest way to send money to the Philippines,Management,['Management'],"['TSP.Gold', 'Kane', 'Randall', 'TSP.Gold', 'Josie', 'Wayne']",Paypal’s failures are unending. What is a good alternative?,"['Paypal’s failures are unending. What is a good alternative?', 'This is my current favorite service to send money abroad:\n\n\n\nTransferWise\n\n\n\nSend Money to Philippines | Wire Transfer to Philippines from USA - TransferWise\nSending money to Philippines? Send money to your friends, family or business partners in Philippines at a great rate with TransferWise. Over 6 million happy users. Low fees, fast transfers.\n\n\n\n\n\n\nIf anyone knows of one with lower fees, I’m all ears', 'Can I ask what kinds of failures are happening with Paypal?  They say:\n""Send to a PayPal email address or a mobile number. If your recipient does not have a PayPal account, you can create one quickly and for free.\nHow much does it cost?\n2.00 USD when paying with bank or PayPal Cash or Pay Pal Cash Plus account balance.\nWhen will the funds arrive?\nMoney transfers usually within seconds to a PayPal account. Then, 2-4 days for withdrawal to a bank account.""\nSeems like a reaonable cost.', 'Paypal is blocking my employees from receiving their money. Most the\ntime they charge $5.00 per transaction.', 'I’ve been using Remitly to send money to my VAs in the Philippines for a several years. It’s instantaneous and completely reliable.', 'Veem works great for me!']"
122,EFT Call for 1/2020: Should you add brand management services to your Amazon business?,Management,"['Management', 'Leadership']",['LizD'],"On today’s call we discussed a number of topics (from 2020 goals to Amazon reimbursement services), but really dug deep into the pros and cons of brand management.  Listen now to get insight on:   typical brand management fees (%) setting expectations with brands how to outsource or hire to do the actual management work how to communicate to the brand the value of the work you’re doing  (you’d better be bragging so they get reminded of your value when it comes time to send you a check!) the freq...","['On today’s call we discussed a number of topics (from 2020 goals to Amazon reimbursement services), but really dug deep into the pros and cons of brand management.\nListen now to get insight on:\n\ntypical brand management fees (%)\nsetting expectations with brands\nhow to outsource or hire to do the actual management work\nhow to communicate to the brand the value of the work you’re doing\n(you’d better be bragging so they get reminded of your value when it comes time to send you a check!)\nthe frequency of contact with the brand (what to provide to them weekly & monthly, and how to deliver that information)\netc\n\nWhat is your take on brand management? Please reply.\nIf you aren’t yet an EFT member, become one today.']"
123,Success habits vs failure habits,Management,['Management'],['Trent-Admin'],"2020 is upon us and for many, now is a time for new year’s resolutions.  Sadly, most of these resolutions (lose weight, make more money, find love, etc…) will never become a reality.  Why?  Because they are not supported by an action plan that makes achieving these goals the likely outcome.  What do I mean?  In order to achieve more, you need to have a clearly defined action plan, supported by a set of daily & weekly habits. Without this in place, your goals are nothing more than things you hope ...","['2020 is upon us and for many, now is a time for new year’s resolutions.\nSadly, most of these resolutions (lose weight, make more money, find love, etc…) will never become a reality.\nWhy?\nBecause they are not supported by an action plan that makes achieving these goals the likely outcome.\nWhat do I mean?\nIn order to achieve more, you need to have a clearly defined action plan, supported by a set of daily & weekly habits. Without this in place, your goals are nothing more than things you hope to achieve, and I can assure that hope is not a strategy for success.\nHoping that the train coming towards you on the tracks doesn’t kill you is not nearly as effective as simply moving out of the way!\nIn my prior emails, I’ve been talking a great deal about a book called The Slight Edge.\nOver the holidays, I mentioned this book to several of my friends and did my best to encourage them to read it.\nIf you have started to read the book, I’d love for you to share your biggest take away so far. Do it now, ok? Even if it is only a sentence or two.\nIn my case, my biggest take away has been that I now think about how to “Slight Edge” pretty much everything in my life…and as a result, forming important daily habits has become much easier for me.\nI now have a habit app on my phone called Productive and each day, I’m reminded of the following habits:\n\nRead 10 pages of a book\nMinimum of 20 minutes of cardio\n20 minutes of meditation\nWrite in my gratitude journal\nTake a few moments and consciously think about something specific that I appreciate about my wife and daughter\n\nBy starting my day at 5:30, I have plenty of time for all of the above and it is a fantastic way to start my day!\nAs for my action plan, I have my “big rocks” for the first 90 days of 2020 already committed to writing, supported by a detailed action plan to achieve them. My wife and I then review this plan vs our progress each month so that we can see if we are on track or not.\nIf you have goals you are committed to achieving in your business in 2020, I encourage you to take the same approach.']"
124,Takeaway #1 from mastermind,Management,['Management'],"['Trent-Admin', 'gianmeliShanghai', 'Trent-Admin']","While I was at the mastermind weekend I wrote about yesterday, I took about 10 pages of notes that are going to massively boost my income in 2020.  Over the next week or so, I’m going to share some of my biggest takeaways.  Here’s the first…  If you are selling stuff online, you should seriously consider building (and amplifying) a personal brand.  Why?  Authority, credibility, and revenue on demand. (Bright Ideas is the most profitable thing I do)  While I have been building my brand for years,...","['While I was at the mastermind weekend I wrote about yesterday, I took about 10 pages of notes that are going to massively boost my income in 2020.\nOver the next week or so, I’m going to share some of my biggest takeaways.\nHere’s the first…\nIf you are selling stuff online, you should seriously consider building (and amplifying) a personal brand.\nWhy?\nAuthority, credibility, and revenue on demand. (Bright Ideas is the most profitable thing I do)\nWhile I have been building my brand for years, I have not been amplifying it nearly as well as I should have been. In 2020, that is going to change and my income is going to go up. A lot.\nHow do you amplify?\nAd spend.\nMore ad spend = more eyeballs = more subscribers = more revenue on demand.\nTomorrow, I’ll dig more into the ways to do this.\nFor today, my ask is this: please take 2 minutes right now to complete my community feedback survey.\nWhy? Because I’m going to come out with some free training material for you and if you don’t tell me what you want/need, I won’t know what to create.\nSound fair?\nGo fill out the survey now, ok?', 'Hi Trent, thank you for this useful insight.\nHow is this specifically helping you to grow your Amazon business?\nI understand the importance of building a personal brand, but are you suggesting that to be something complementary to the amazon business and potentially making an other income stream through for example podcasts, courses, blogs, etc?\nIs this what you mean or am I missing something?\nThanks', 'On more than one occasion, brands that we spoke with mentioned that they had research me and, thanks to all the content I produce, they were very complimentary of my skills/experience and each time this happened, we won the account.']"
125,Pain is necessary,Management,['Management'],['Trent-Admin'],"Today I started my morning like I always do; by watching motivational speeches on Youtube while I’m in the bathroom shaving, brushing my teeth, etc…  I like to start my day this way because it fires me up and ensures that when I sit down at my desk, I’m ready to make shit happen!  If you don’t yet have a morning routine that includes meditation, consuming inspirational content, and whatever else you need to get your head in the game, I’d like to challenge you to start TODAY.  To help you with th...","['Today I started my morning like I always do; by watching motivational speeches on Youtube while I’m in the bathroom shaving, brushing my teeth, etc…\nI like to start my day this way because it fires me up and ensures that when I sit down at my desk, I’m ready to make shit happen!\nIf you don’t yet have a morning routine that includes meditation, consuming inspirational content, and whatever else you need to get your head in the game, I’d like to challenge you to start TODAY.\nTo help you with that, I’m going to share with you the video that I watched this morning: https://youtu.be/3wi65UW_nJk\nThis video was created by an African American man who grew up in the projects. His name is William King Hollis and if you think you have any disadvantages that are preventing you from being more successful in business and in life, I suspect hearing his story might help you to put that in perspective.\nIf you want to be successful in business; pain is necessary. If it wasn’t, everyone would own a successful company, wouldn’t they?\nThe difference between those that do, and those that only talk, is their ability to suffer through the pain.\nWant proof? Think about anyone that has ever won a gold medal. Think their training was pain free?\nThink about any actor that has hit it big. Think their early years were pain free?\nI doubt it.\nPain is necessary. If you want to become financially successful, you have to be 100% committed to that goal; regardless of how much pain you are going to have to endure.\nNow go make it happen!\nTrent\nPS. I’m planning to come up with more free training content and need your feedback so I know exactly what I need to create. Please tell me what you need, ok?']"
126,Takeaway #2 from the Mastermind Weekend,Management,['Management'],"['Trent-Admin', 'Mitch', 'Trent-Admin']","Today I’m going to share my next big takeaway from the mastermind I attended last weekend.  As I wrote yesterday, the biggest area that I have dropped the ball in building my personal brand has been to rely solely on organic traffic and not use any advertising.  In 2020, I’m going to start advertising, and I’m going to do it in two ways.  Way #1: Facebook retargeting campaigns. Thankfully, I’ve had a Facebook pixel on my site for ages, so my Facebook audience will be pretty big and as retargetin...","['Today I’m going to share my next big takeaway from the mastermind I attended last weekend.\nAs I wrote yesterday, the biggest area that I have dropped the ball in building my personal brand has been to rely solely on organic traffic and not use any advertising.\nIn 2020, I’m going to start advertising, and I’m going to do it in two ways.\nWay #1: Facebook retargeting campaigns. Thankfully, I’ve had a Facebook pixel on my site for ages, so my Facebook audience will be pretty big and as retargeting is the cheapest way to advertise online, showing ads to people who have already been to my site will be pretty inexpensive.\nWay #2: Running Youtube ads to cold traffic (people who have never been to my site and have no idea who I am). These campaigns will be more costly and I actually did experiment with them a tiny bit in mid 2019.\nBeing as I want to learn a lot more about running ad campaigns, expect me to publish more interviews with ad experts in the weeks/months ahead.\nIn fact, I just recorded one with a woman who used to work at both Facebook and Instagram and I’m working on putting a deal together with her to run my campaigns for me.\nWhen it comes to running ads, you have to lay the right foundation, and a huge part of that foundation is knowing exactly what your audience wants, as well as the language they use to describe it.\nThat is why I’m asking you to take 2 minutes to fill out my community feedback survey.\nWhy take the time to help me? Because I’m going to help you by coming out with more free training material for you and if you don’t tell me what you want/need, I won’t know what to create.\nSound fair?\nGo fill out the survey now, ok?\nTake my survey now: http://brightideas.co/survey\nHave a question you’d like me to answer? Post your question below.', '@Trent-Admin What makes the retargeting ads less expensive than the cold traffic ads?', 'They just are. I don’t know why.']"
127,How to significantly increase your supplier lead generation,Management,['Management'],['Trent-Admin'],"On yesterday’s eCommerce Fast Track mastermind call, one of our members (Ben) and I talked about some of the things I learned while at the mastermind, and what I’m about to share with you is particularly applicable to your prospecting for new suppliers.  Why do so many sellers struggle to generate product/supplier leads?  They struggle because lead generation is a level 3 problem and they start doing it before completing the work needed for level 1 and level 2.  What are the first two levels, yo...","['On yesterday’s eCommerce Fast Track mastermind call, one of our members (Ben) and I talked about some of the things I learned while at the mastermind, and what I’m about to share with you is particularly applicable to your prospecting for new suppliers.\nWhy do so many sellers struggle to generate product/supplier leads?\nThey struggle because lead generation is a level 3 problem and they start doing it before completing the work needed for level 1 and level 2.\nWhat are the first two levels, you ask?\nLevel 1 is authority and level 2 is positioning.\nThink about this for a minute. If I’m trying to get you to book a call with me to consider partnering up to sell your products on Amazon and I don’t have any authority/credibility, how likely are you going to be to book a call with me?\nNot very likely.\nNow considering my positioning (messaging).\nIf one Amazon seller’s website messaging is “we sell on Amazon” and their competitor’s messaging is “we help brands solve Amazon-related problems”; which company would be more likely to appeal to a brand?\nObviously, it would be the company that helps brands solve their problems (because there are already far too many sellers that don’t do anything more than sell the product)\nSo…does it make sense to you that generating leads would be a lot easier if you have plenty of authority and the right positioning?\nOf course it would be easier!\nWant to learn more stuff like this from me? Please take a minute to fill out my community feedback survey, ok? Here’s the link: http://brightideas.co/survey\nWhy take the time to help me? Because I’m going to help you by coming out with more free training material for you and if you don’t tell me what you want/need, I won’t know what to create.\nSound fair?\nGo fill out the survey now, ok?\nTake my survey now: http://brightideas.co/survey\nHave a question you’d like me to answer? Post your question below, ok?']"
128,What is the biggest obstacle to your success?,Management,['Management'],"['Trent-Admin', 'Moondog', 'Alex_Rodriguez', 'Trent-Admin', 'Trent-Admin', 'TSP.Gold', 'laserdad', 'Mitch']","Yesterday, I was down in San Diego for the final day of a 2-day mastermind event filled with other online business owners doing 6-7 figures and the new ideas and growth strategies that I have been exposed to over the last weekend were nothing short of incredible.  I also realized that, much to my disgust, I’ve had a few limiting beliefs preventing me from ramping up my business even faster.  For example; every entrepreneur on planet earth struggles to raise capital; especially in the beginning.  ...","['Yesterday, I was down in San Diego for the final day of a 2-day mastermind event filled with other online business owners doing 6-7 figures and the new ideas and growth strategies that I have been exposed to over the last weekend were nothing short of incredible.\nI also realized that, much to my disgust, I’ve had a few limiting beliefs preventing me from ramping up my business even faster.\nFor example; every entrepreneur on planet earth struggles to raise capital; especially in the beginning.\nDid you know that there is a way to access capital with a 0% interest?\nDid you know that you can use this capital to buy inventory, hire employees, and even buy a business or real estate?\nIf someone had walked up to me on the street and told me this was possible, I would have laughed at them.\nWell guess what? I was wrong, and you can access this capital simply by googling “zero interest credit cards”.\nThe worst part about limiting beliefs is that we usually don’t even know if we have them.\nTo find yours, all you need to do is hang out with people more successful than you, be curious, and ask questions.\nHere’s my question for you today: What is the #1 thing standing in your way right now? Please put your comment below.', 'Hi Trent,\nMy biggest limitations are time and money right now. Thanks for inspiring me  every day!!!\nEd', 'Hello,\nThe #1 thing standing in my way is fear of the unknown.  I constantly ask myself ‘will Amazon be a business that I thrive and succeed in?’.  The only way to know is to get good coaching and take massive action to ensure my success.  That is why I purchased WEBS so that I have a template for success.', 'Ed…google “zero interest credit card offers” and you working capital issues will be solved', 'Hi Alex…thanks for leaving a comment. We are considering offering a group coaching program in the new year, so keep an eye out for that.', 'They work well, and they fill a specific niche when finances are tight. Just be sure to pay them off before the deadline. The interest rates after the deadlines are not forgiving.', 'My biggest fear is buying from China and getting scammed with a container of poor quality junk…', 'I wouldn’t recommend buying from China without a ton of due diligence and a purchase method that allows you to recoup your money if the product is poor.  Furthermore, I wouldn’t recommend buying a container of product on initial purchase.\nThere is plenty of lower risk opportunity elsewhere!']"
129,Business name,Management,"['Management', 'Leadership']","['almoodie', 'APlusSeller', 'almoodie', 'Mitch', 'LizD', 'almoodie']","I have an Amazon FBA RA business which sells 500-600k per year. The business is named something like “Acme Internet” and I have had this DBA registered business for over 10 years.  Trent suggests/recommends setting up an LLC as a first step in starting wholesale/WEBS.  What do you recommend I do:   Just use “Acme Internet”  2 Register “Acme Internet LLC” and change my Amazon business name to same Open a 2nd Amazon account just for wholesale (loose all my vendor reviews) Other  Thanks,  Al.","['I have an Amazon FBA RA business which sells 500-600k per year. The business is named something like “Acme Internet” and I have had this DBA registered business for over 10 years.\nTrent suggests/recommends setting up an LLC as a first step in starting wholesale/WEBS.\nWhat do you recommend I do:\n\nJust use “Acme Internet”\n2 Register “Acme Internet LLC” and change my Amazon business name to same\nOpen a 2nd Amazon account just for wholesale (loose all my vendor reviews)\nOther\nThanks,\nAl.', 'I would recommend filing the LLC in the same name. There is no need to change your seller name.\nJust make sure that you change the owner info in your account to match your new LLC.', 'So I have the DBA “Acme Internet”\nI then register “Acme Internet LLC”\nI have a Sales Certificate listed as “Acme Internet” (had it for 4 years), do I need a new Sales Certificate for ""Acme Internet LLC or will the existing certificate work.\nBroader question, Trent says I need an LLC. I assume this is for credibility. Would my DBA and existing Sales Cert be sufficient…', '@almoodie I’m not sure about this.  We try to stay away from giving legal advice but maybe @Trent_Dyrsmid or @LizD will chime in here.', 'Amazon requires a good reason to open a second seller account. You can probably have it done but I’d suggest you consider registering the LLC in the same name. Again, that’s not legal advice tho \nLLC is not just for credibility but liability also. Most brands will be fine with your current sales certificate; the DBA vs LLC may actually never come up… maybe if you’re importing something through customs.', 'Thank you LizD and all.']"
