,Topic Title,Category,Tags,Authors,Leading Comment,Other Comments
32,Tax interview for non US citizen with US LLC,Amazon Specific,['Amazon Specific'],"['watson', 'AnthonyD', 'watson', 'AnthonyD', 'watson', 'AndrewL', 'watson', 'AndrewL', 'AndrewL', 'watson', 'just_neo', 'watson', 'just_neo', 'saisfy', 'watson', 'saisfy', 'carlos_federico_igle']","Hoping someone may know the answer here…  I’m a non US citizen with a US LLC. Currently i’m selling under my own name because in the tax interview it says for single member LLCs, put your own personal name.  However, of course i’d much rather be registered under my LLC name and address.  And if i have a US registered LLC, surely that is a business and US entity that is subject to US taxes?  When i enter “business” rather than “individual” on the form instead and say i’m a US person for tax reaso...","['Hoping someone may know the answer here…\nI’m a non US citizen with a US LLC. Currently i’m selling under my own name because in the tax interview it says for single member LLCs, put your own personal name.\nHowever, of course i’d much rather be registered under my LLC name and address.\nAnd if i have a US registered LLC, surely that is a business and US entity that is subject to US taxes?\nWhen i enter “business” rather than “individual” on the form instead and say i’m a US person for tax reasons, it asks what kind of LLC - C-Corp, S-Corp or Partnership, then i can enter my EIN number (My LLC is just a simple single member LLC, no mention of any C-Corp or S-Corp)\nAnyone also have an issue with this?  Don’t want to get anything wrong!\nReally appreciate any feedback', 'Disclaimer first: I’m not a US tax accountant or US financial advisor. All I am sharing below is based solely on my own personal experience, and professional advice provided to me. I strongly recommending you always seek independent legal and/or financial advice.\nI hope the following helps you better understand the issue so that you can gain a bit more clarity and decide how to move forward.\nI too am non US resident and I know exactly what you’re talking about in this scenario.\nThis is one of the reasons I actually shut down my US single member LLC and established a company in my own country.\nAmazon’s tax interview is setup correctly, and does ask the correct questions from a tax perspective.\nThe issue is however, their system drags across the single member details and uses that same information as the legal entity, thus why your personal name shows up as the legal entity inside of Seller Central.\nI escalated this issue on numerous occasions with Amazon and explained the issue even at their legal level, however, despite also having sought clarification through a US based tax attorney, Amazon still said it is setup correctly in their system.\nThere is no way around it as a single member LLC entity when you’re an international non resident single member.\nThe biggest issue I could foresee with this is that your vendor issued invoices will always be in the name of the legal entity, your LLC, and so this will never match with Amazon’s backend system.\nIf Amazon ever asks for invoices for verification, you’ll very likely hit major issues, an unlikely be able to prove anything.\nOperating under wholesale business model using that legal structure is risky, especially with the level of frivolous IP and authenticity claims that occur on the platform now.\nYou’ll also never be able to get ungated if requested to provide invoices because again, the entity details wont’ match. I know this for sure because I experienced and lost money from it.\nAlso, be aware of the additional reporting requirements that the IRS now has in place for non resident LLCs.\nVery few people are aware of these new requirements until it is too late.\nThere are all very important considerations you should understand when deciding to continue operating as a US entity, and another reason why I would suggest you seek professional advice from someone who specialises in US tax law for NON US residents.\nI hope this helps.\nAll the best.', 'Hey there,\nThanks very much for your very detailed reply, really appreciate it.\nYes those issues you mentioned i already came across (invoices with my LLC name) but i got around it by asking them to put my own name and address on it, which they were happy to do but that just sounds amateur to most suppliers i’m sure.\nI’ll be getting in touch with a professional as well as looking into a limited company in my own country.\nI assume you’re operating under your company name in your home country, my i ask if your US suppliers have an issue with this?\nThanks very much again', 'Hi,\nI’m glad it helped.\nUnfortunately it’s another one of the many challenges us internationals experience when starting out on the marketplace in the USA.\nYes I established a new company in my home country and then applied for an EIN, which you will need to sell on the marketplace, and yes, it is very easy to get via a phone call to the IRS.\nThen it’s up to you whether you get a reseller certificate.\nYou don’t need one, however you will find a LOT of brand owners who won’t open an account unless you provide them with one, even when you clearly explain that you’re an entity domiciled outside of the USA so legally don’t need one as I was advised by a tax attorney.\nIt’s more to remove that as an objection, but it does come with compliance requirements.\nOnce again, decide which way is right for you once you speak with a professional.\nHope this helps.', 'Hi,\nI’ll be investigating your way of doing things this weekend.\nThis information is a massive help, and once again, it’s hugely appreciated!\nWish you all the best with your business\nP.S Anyone following this i’ll update it if i have anything new to report about this issue', 'Hi AnthonyD.\nVery useful advice, thanks for sharing.\nAre you able to share the details of the accountant you use please? I’ve been searching high and lo for one which specialises in tax issues for non-US companies selling in the US, but haven’t found one yet. Appreciate your help.\nKind Regards,\nAndrew', 'Hi buddy, i know this isn’t directed at me, but look up taxesforexpats.com.\nI’ve used them before to file a US tax return from outside the US, was a good service.', 'Hey Watson, thanks for the link. Really helpful', 'It does seem to me that there is no “one-stop-shop” UK accountant who will deal with all the UK and US tax issues. So you need to pay two accountants!', 'That sounds about right, but I don’t know about that because when i filed my US return i didn’t need to do one for the UK as i don’t live there, so i don’t pay taxes there.', 'Did you find any solution ?', 'Hi there, yes i did. I simply entered my business name and details with its EIN.\nIt worked for me, but i’ve read it didn’t work for others, so it’s up to you if you want to give it a try.  If you give it a try and if it doesn’t work you’ll know right away as you’ll have a message. If there’s no message it should have been accepted. If it hasn’t been accepted i think you can re enter your previous details as it was before, good luck.', 'Glad to hear that everything is going very well with your Amazon account, and thanks for your response.\nI will try to do what you suggest.\nI need to talk with you for more details on seller account setup as we are in the same situation, how I can contact you?', 'Hi,\nIs this reply about the amazon tax interview?\nHow were you able to enter your business name and EIN?\nI have the same case as you previously describe some months ago (foreign-owned single-member LLC incorporated in the US).\nCan you please share with us what did you reply in the interview?\nWhat is your tax classification?\nIndividual /  Business\nFor U.S. tax purposes, are you a U.S. person?\nYes / No\nThanks a lot!', 'Tax classification - Individual\nFor U.S. tax purposes, are you a U.S. person? Yes\nFilled in my business details and EIN and it was done.\nThis worked for me, it may not work for you. I’m certainly NOT a professional so i am absolutely not responsible if it doesn’t work for you.', 'Hello there,\nThanks for sharing your info!\nI completed the tax interview the same way as you explained, and got a "" Your tax information has been validated successfully."" reply from amazon right away.\nHowever, I checked how my Legal business name appers on amazon seller central, and it shows my personal name instead of my business name. When I filled the tax interview questionary, for question “Name (as shown on your income tax return)” I put my personal name, as this is how should be shown for the tax return form…\nDid you encounter the same issue?\nThanks again!!', 'Hi guys. Thanks for the information. It has been of great help. But I need to complicate things a little bit more. I have already paid two CPA’s for this and even though the indicated I am right about the pass through status of my LLC partnership we don’t know how to go through Amazon tax interview.\nI have a partner. And we created an LLC. We are both non usa residents and we do not have any Nexus in the USA. So I guess we are  a pass through entity.\nBut while taking the tax interview, the only available options are to be classified as a""Bussines"" “us person for tax purposes” and after that we shall present a w9 form.\nI supposed I shall fill a w8 form.\nIs that w9 form we have been asked by amazon ok. Or are we going to be taxed in the USA as a corporation? Thanks']"
33,Seller Legend: compare month-over-month data,Amazon Specific,"['Amazon Specific', 'Inventory Management']","['Blue', 'Mitch']","We’ve recently begun using Seller Legend and can already see its potential.  Does anyone know how to compare month-over-month sales data, though?","['We’ve recently begun using Seller Legend and can already see its potential.\nDoes anyone know how to compare month-over-month sales data, though?', '@Blue Ya Seller Legend is awesome.\nGo to Sales -> Sales Statistics and then change your view to “By Month Chart”.  You can then change the time period for the months you want to view.\nSellerLegend___Sales_Statistics1166×280 29.1 KB']"
34,"Just got approved for ""dangerous goods"" but can't switch to FBA",Amazon Specific,"['Amazon Specific', 'Inventory Management']","['randy1', 'Mitch']","We recently filled out the Dangerous Goods exemption form and got approved for Not Hazardous.  However, we then tried changing the shipment from merchant-fulfilled to FBA, but are again asked to fill out the Dangerous Goods form. This is very odd 🧐  Has anyone ran into this before?","['We recently filled out the Dangerous Goods exemption form and got approved for Not Hazardous.\nHowever, we then tried changing the shipment from merchant-fulfilled to FBA, but are again asked to fill out the Dangerous Goods form. This is very odd \nHas anyone ran into this before?', '@randy1 Did you provide SDS sheets as well?  Usually that is what they are looking for to take a product off the Hazmat list.\nIt is strange they told you that they changed the status to not hazardous.  It is probably worth a call into Amazon to find out if they actually got the status changed in their system.  I wouldn’t be surprised if they asked for SDS sheets though.']"
35,FBA inventory storage fee breakdown,Amazon Specific,"['Amazon Specific', 'Inventory Management']","['randy1', 'Mitch', 'randy1', 'Mitch', 'randy1', 'Mitch']",Hey guys!  I’m looking for a report that shows FBA storage fees that we get charged. Specifically I want to see it broken down by unit. Does something like this exist?  Thank you very much.,"['Hey guys!\nI’m looking for a report that shows FBA storage fees that we get charged. Specifically I want to see it broken down by unit. Does something like this exist?\nThank you very much.', '@randy1 I know Seller Legend reconciles expected vs actual fees in its sales stats if you are looking at sales that are over about a week old.\nThrough Amazon, you can see what you will likely be charged per ASIN by going to Reports -> Fulfillment -> Fee Preview.\n\nFulfillment_Reports_-_Amazon1237×526 96.4 KB', 'Thanks @Mitch! However that’s just estimates, is there no report in Amazon that shows the actual fee breakdown?', '@randy1 if you are just looking for storage fees, two down from the fee preview is the Monthly Storage Fees report.  From that you can find what you are being charged per unit per ASIN.  It includes item volume, size classification, and volume cost.\nIt’s broken down by warehouse so, if you want to be sure of total cost/unit, you’ll have to do a sumif function by ASIN to find what you are being charged across all warehouses.', 'Thank you Mitch!', 'Anytime Randy!']"
36,Choosing a niche for selling on Amazon,Amazon Specific,"['Amazon Specific', 'All Other Amazon Related Issues']","['almoodie', 'Mitch']","Trent recommends choosing a niche category for selling Wholesale on Amazon. How important is this.  Here’s the list of categories I have narrowed it down to:  Automotive & Powersports  Camera & Photo  Consumer Electronics  Grocery & Gourmet Foods  Health & Personal Care  Industrial & Scientific  Office Products  Personal Computers  Software  Sports  Tools & Home Improvement  I’m hung up here, any input appreciated.","['Trent recommends choosing a niche category for selling Wholesale on Amazon. How important is this.\nHere’s the list of categories I have narrowed it down to:\nAutomotive & Powersports\nCamera & Photo\nConsumer Electronics\nGrocery & Gourmet Foods\nHealth & Personal Care\nIndustrial & Scientific\nOffice Products\nPersonal Computers\nSoftware\nSports\nTools & Home Improvement\nI’m hung up here, any input appreciated.', '@almoodie You may have trouble getting input on this as other sellers don’t want to point you toward the niche they have also chosen. Be sure you are considering object size, category revenue size, number of sellers in the category (tough info to find), and category growth.\nAlso look for any missing roles within the niche you may be able to fill.  If you have prior experience in any of these niches it would be a good selling point when talking to brands.']"
37,Thoughts on chasing price,Amazon Specific,"['Amazon Specific', 'Pricing Management']","['BobG', 'APlusSeller', 'BobG', 'Mitch']","Hi there,  I have a new wholesale product that has had two FBA sellers on it for what looks like a while.  Now I show up with my inventory and list slight higher than the lowest seller and he appears to have a repricer that immediately drops his price.  I once again go down to just slight above his price and he goes down again… I do seem to have found his floor but my question is this, would you wait for him to sell through his inventory or follow him down to get a portion of the buy box.  Of co...","['Hi there,\nI have a new wholesale product that has had two FBA sellers on it for what looks like a while.  Now I show up with my inventory and list slight higher than the lowest seller and he appears to have a repricer that immediately drops his price.  I once again go down to just slight above his price and he goes down again… I do seem to have found his floor but my question is this, would you wait for him to sell through his inventory or follow him down to get a portion of the buy box.  Of course he can always replenish.  Any thoughts?  I', 'How much higher were you pricing?', 'I am trying to stay within 2% above of the lowest FBA seller.', '@BobG Does the supplier have MAP in place?  Pricing is a HUGE issue for brands that give you a great in.  Ask the brand some questions about MAP and where they want their online pricing to be.  See where that conversation leads and maybe you can turn it into an exclusive or get the product at a better price than the other sellers.\nIf the other sellers can easily get more product, the only outcomes are to make slim margins; or for one of you to find out what the brand wants and partner with them to make it happen.']"
38,Share reorder process,Amazon Specific,"['Amazon Specific', 'Inventory Management']","['MaRa', 'Mitch', 'MaRa', 'Mitch']","Hi,  Anyone can share the reorder process?  Do you reorder each day by the recommendation of tool?  Or you have a weekly process?  How to track all the shipments?  How to automate this process?  Thanks","['Hi,\nAnyone can share the reorder process?\nDo you reorder each day by the recommendation of tool?\nOr you have a weekly process?\nHow to track all the shipments?\nHow to automate this process?\nThanks', '@MaRa We use Seller Legend to guide us on when to reorder.  Depending on how many products you have, you can also go by Seller Central’s suggestions on when to reorder.\nI try to group reorders and will have reorder blocks 2 or 3 times a week depending on the total number of reorders I need to do.\nTracking the shipments is explained in the shipping SOPs; specifically the Supplier Inbound Shipment and Create an Inbound Shipment to Amazon SOP.\nOverall you may be able to automate much of the reorder process but you need to be very careful.  If your settings are off or you have a sales spike, you can easily place a bad order and have capital tied up in Amazon warehouses for an extended period.\nIf you want to automate the reorder process, I’d recommend shortening the number of days you buy inventory for (i.e. 14 days or so).', 'Hi Mitch,\nThank you.\nHow about the lead time,lets say if we have some products lead time for 7-8 days and the same brand other Asins 14-21 lead time.\nDo you use lead time in the Asin level or the brand level?', '@MaRa With a significant difference such as that, I would say ASIN level.  For most we stick to brand level but, for one of our suppliers, we have different ASIN lead times for products we ship direct to Amazon vs those we ship to our warehouse.']"
39,Add a new product to a sponsored ad campaign?,Amazon Specific,"['Amazon Specific', 'PPC']","['randy1', 'Joel', 'randy1']",I’m struggling trying to add a new product to an existing campaign. It doesn’t seem intuitive at all.  Does anyone know how? Thank you!,"['I’m struggling trying to add a new product to an existing campaign. It doesn’t seem intuitive at all.\nDoes anyone know how? Thank you!', 'The menu selection goes like this:\nAdvertising/campaign name/group name/Add products to advertise\nThe button you want is in the menu bar:\n\nAdd%20products%20to%20advertise1872×52 8.85 KB\n Advertising/campaign/Add group/Add products to advertise', 'Thanks Joel!']"
40,iPhone 11 won't scan UPC codes properly?,Amazon Specific,"['Amazon Specific', 'Software & Tools']","['jims', 'Mitch', 'jims']","I recently upgraded my phone, and now I’m having a lot of difficulty scanning UPC codes. Basically 10% of them work properly. I’ve tried changing lighting, angles, but nothing seems to help for those codes that won’t scan.  Has anyone else noticed this?","['I recently upgraded my phone, and now I’m having a lot of difficulty scanning UPC codes. Basically 10% of them work properly. I’ve tried changing lighting, angles, but nothing seems to help for those codes that won’t scan.\nHas anyone else noticed this?', '@jims I don’t trust phone upgrades ha.', 'Hehe you’re probably right']"
41,Returned item without reason described?,Amazon Specific,"['Amazon Specific', 'Reviews & Customer Service']","['zaid', 'Mitch']",I heard that Amazon had a policy update where customers would be required to enter a reason for why they’re returning an item.  However we’re still getting the occasional return where there’s no reason listed.  Does anyone have any news on this?,"['I heard that Amazon had a policy update where customers would be required to enter a reason for why they’re returning an item.\nHowever we’re still getting the occasional return where there’s no reason listed.\nDoes anyone have any news on this?', '@zaid I’m not sure about the policy update but could the customer be putting the return reason as other and not putting in what the “other” is when prompted?']"
42,"Amazon sellers say online retail giant is trying to help itself, not consumers",Amazon Specific,"['Amazon Specific', 'All Other Amazon Related Issues']","['Trent-Admin', 'Mitch']","Just ran across this article and wanted to share it. If you have thoughts or comments, leave them below.","['Just ran across this article and wanted to share it. If you have thoughts or comments, leave them below.', 'Solid article.  The continued expansion of Amazon branded products is going to continue to make it harder on third party sellers and reaffirms the need to advertise to get page views.  I’m not sure if the company needs anti-trust enforcement, but the bit at the end about absorbing an unjustified cost increase makes a good point.']"
43,Brand health - Question about optimized search terms,Amazon Specific,['Amazon Specific'],"['liahsidney', 'Mitch']","Received notification that 1 or 2 of my listings are “high risk” and recommendations are ""not optimized. This is in the Brand Health, in the Optimized Search Terms page. I wanted to know what that “high risk” tag meant. I hope someone can help.","['Received notification that 1 or 2 of my listings are “high risk” and recommendations are ""not optimized. This is in the Brand Health, in the Optimized Search Terms page. I wanted to know what that “high risk” tag meant. I hope someone can help.', '@liahsidney Is this tied to the voice of the customer or NCX score?  Could you blur some stuff out and post a picture?  This is a difficult question to answer so being able to see it would help quite a bit.']"
44,Amazon Product Listing Removed,Amazon Specific,['Amazon Specific'],"['D.Jin', 'Mitch', 'D.Jin', 'Mitch']","Hi,  One of my products has been removed. I reached out to AmZ support and the product was removed as the product does not respect the intellectual property rights of others. Your listings might be using the trademark “brand x” incorrectly.  My product is to be used with brand x. Brand x’s name was on the listing. I believe because it had the brand’s name, it was removed.  Can you please advise what would be the best way to reinstate the product?  Cheers,  David","['Hi,\nOne of my products has been removed. I reached out to AmZ support and the product was removed as the product does not respect the intellectual property rights of others. Your listings might be using the trademark “brand x” incorrectly.\nMy product is to be used with brand x. Brand x’s name was on the listing. I believe because it had the brand’s name, it was removed.\nCan you please advise what would be the best way to reinstate the product?\nCheers,\nDavid', '@D.Jin Sometimes if you have “compatible with” before the brand name Amazon won’t flag the listing but that isn’t always the case.  Depending on how much the listing is worth to you, you may hire an outside company to appeal the restriction.  Otherwise, you will have to put an appeal in yourself and make your case.\nI’d recommend searching for “Intellectual Property Violations” in Seller Central Help.  Check the forums and see what you can learn about the process.  These cases are tricky so do your research before getting on the phone with Amazon.', 'Thank you for your help! Putting ‘compatible with’ fixed the issue.', 'Glad to hear it @D.Jin!']"
