,Topic Title,Category,Tags,Authors,Leading Comment,Other Comments
0,About the Human Resources category,Human Resources,Human Resources,Kane,Have questions about Human Resources? This is the category to use. Please be sure to select the most appropriate sub-category for your questions.,"
Have questions about Human Resources? This is the category to use. Please be sure to select the most appropriate sub-category for your questions.
"
1,VA using PC2 & Revseller,Human Resources,Human Resources,twentyfoursevenagent,My VA reported not having the Amazon Browser in his PC2. He downloaded the paid software  & is using a US address VPN. He entered the correct MWS and Seller ID but still cant get it to work.  Does he have to be actually signed in my Amazon Seller account when setting up PC2?  Also considering subscribing to Revseller too. It seems that I also have to be logged in my Seller Central account for it to show brand restrictions. Any suggestions?,"
My VA reported not having the Amazon Browser in his PC2. He downloaded the paid software  & is using a US address VPN. He entered the correct MWS and Seller ID but still cant get it to work.
Does he have to be actually signed in my Amazon Seller account when setting up PC2?
Also considering subscribing to Revseller too. It seems that I also have to be logged in my Seller Central account for it to show brand restrictions. Any suggestions?
"
2,Training a VA to find brand contact information,Human Resources,Human Resources,Cameron.B,"Hello everyone, I’m having trouble helping to train my VA to find the contact information for brands. My linkedin profile has fifty+ connections, but when doing some brand contact research with my VA we both have been running into blocked pages of people. Keep in mind this is with a LinkedIn premium business account, although it’s still the first free month.  I’m wondering if the first free month actually has all the same capability as when I actually start paying next month, but maybe not?  Als...","
Hello everyone, I’m having trouble helping to train my VA to find the contact information for brands. My linkedin profile has fifty+ connections, but when doing some brand contact research with my VA we both have been running into blocked pages of people. Keep in mind this is with a LinkedIn premium business account, although it’s still the first free month.
I’m wondering if the first free month actually has all the same capability as when I actually start paying next month, but maybe not?
Also, when showing my VA how to find the company website, using that to find their linkedin page, to then use snov.io to find contact information on their company page. What else can I do to help train my VA? I was thinking of just showing her more examples of how I do the research, but maybe there is something else I can get to reveal information about businesses I will be reaching out to?
I know the TWF guys have talked about being able to buy access to business information for each state? Does anyone remember what that’s called? Is it available through the chamber of commerce of each state?
"
3,Performance reviews for Virtual Assistants?,Human Resources,Human Resources,jims,"Does anyone do this? I’ve considered it, but wasn’t sure if it was normal or not.","
Does anyone do this? I’ve considered it, but wasn’t sure if it was normal or not.
"
4,Best job sites for virtual assistants?,Human Resources,Human Resources,Blue,"Where does everyone find their VAs? I’ve used onlinejobs.ph and upwork.com in the past, but was curious if there’s better options nowadays?","
Where does everyone find their VAs? I’ve used onlinejobs.ph and upwork.com in the past, but was curious if there’s better options nowadays?
"
5,Domestic vs Filipino VAs,Human Resources,Human Resources,dast1983,"Hey everyone -  Need your opinion and experience on outsourcing with domestic vs Filipino VAs. I need someone to contact suppliers and scane Excel spreadsheets and estimate quantities to order for my Amazon business. Currently, I pay a domestic VA $25/hr to do this, and she’s okay. She’s got a great attitude, but doesn’t source a lot of profitable product, unless I hand suppliers her way. This is a fairly complex analytical task…  Do you think I can outsource this to Filipinos and have success…o...","
Hey everyone -
Need your opinion and experience on outsourcing with domestic vs Filipino VAs. I need someone to contact suppliers and scane Excel spreadsheets and estimate quantities to order for my Amazon business. Currently, I pay a domestic VA $25/hr to do this, and she’s okay. She’s got a great attitude, but doesn’t source a lot of profitable product, unless I hand suppliers her way. This is a fairly complex analytical task…
Do you think I can outsource this to Filipinos and have success…or is it a higher paid ($20+ per hour) work to outsource to domestic VAs?
Thanks for your opinions!
Dan
"
6,Budgeting for virtual assistants,Human Resources,Human Resources,MWC1,Doing budgeting for the upcoming year looking to hire four virtual assistants out of the Philippines. What would be a good hourly labor rate to budget?,"
Doing budgeting for the upcoming year looking to hire four virtual assistants out of the Philippines. What would be a good hourly labor rate to budget?
"
7,What email should be used for VA software use?,Human Resources,Human Resources,WillCompere,Does it matter what email you have linked to the software your VAs use? Would it be wise to use a specific software use email for these tasks? like: research@insert website name  This may be negligible and might not matter but part of me thinks to have separate emails used for different tasks in your business could help at separating and delegating out things. Thanks in advance 🙂,"
Does it matter what email you have linked to the software your VAs use? Would it be wise to use a specific software use email for these tasks? like: research@insert website name
This may be negligible and might not matter but part of me thinks to have separate emails used for different tasks in your business could help at separating and delegating out things. Thanks in advance 
"
8,VA-How Would I Locate a VA to enter listings into Amazon & E-bay,Human Resources,Human Resources,Bill,"Good morning to all,  I am new to this forum.  I realize that a weakness of mine is entering listings in Amazon & E-bay. It takes forever & I am not good at it. I would like to enter several “regular/normal” listings as well as listings where I bundle several products together.  What would be the best practice for finding help with this either in the United States or out of the United States?  Thanks to all!  Bill","
Good morning to all,
I am new to this forum.
I realize that a weakness of mine is entering listings in Amazon & E-bay. It takes forever & I am not good at it. I would like to enter several “regular/normal” listings as well as listings where I bundle several products together.
What would be the best practice for finding help with this either in the United States or out of the United States?
Thanks to all!
Bill
"
9,When to use VAs vs employees?,Human Resources,Human Resources,dast1983,"Hi -  So I’m ready to bring on my second regular VA. I’ve made up my mind that VAs, in general, will work best to take care of many gruntwork, time-consuming tasks.  However, this VA will do an important task - sourcing. For now, I can’t afford an employee. So, I’m going to use a VA to at least tide me over until I get closer to that point.  But, by early-to-mid next year, I have a good shot at being able to afford an employee. And then I see some people in this forum use VAs full-time to do sou...","
Hi -
So I’m ready to bring on my second regular VA. I’ve made up my mind that VAs, in general, will work best to take care of many gruntwork, time-consuming tasks.
However, this VA will do an important task - sourcing. For now, I can’t afford an employee. So, I’m going to use a VA to at least tide me over until I get closer to that point.
But, by early-to-mid next year, I have a good shot at being able to afford an employee. And then I see some people in this forum use VAs full-time to do sourcing.
So, when I can afford an employee to do sourcing, how do I decide to go with an employee or with a VA instead?
Thanks,
Dan
"
10,Best va practices,Human Resources,Human Resources,Brandon_Bouchereau,Should we have a VA to only to compile brands and then 1 to do the extraction or depends on the ability of the  VA ? I assume that will be the answer but what is best practice?,"
Should we have a VA to only to compile brands and then 1 to do the extraction or depends on the ability of the  VA ? I assume that will be the answer but what is best practice?
"
11,VAs familiar with WEBS?,Human Resources,Human Resources,gianmeliShanghai,"Hello, can anyone suggest good VAs that are also familiar with WEBS sops?  Can WEBS team provide any?  What is the average hourly rate for these people?  Thank you","
Hello, can anyone suggest good VAs that are also familiar with WEBS sops?
Can WEBS team provide any?
What is the average hourly rate for these people?
Thank you
"
12,Letting go of a VA,Human Resources,Human Resources,steph,What is “best practice” when letting go of a VA? Notice and pay?,"
What is “best practice” when letting go of a VA? Notice and pay?
"
13,Getting a VA for 1.50,Human Resources,Human Resources,mshayanh13,"How do I find a VA for $1.50  FreeeUp requires minimum of $5  and I’ve some people apply to my listing on OnlineJobs.ph, but most of them want higher pay  Also OnlineJobs.ph has monthly fee. Once I hire, do I cancel the onlinejobs account and pay the VA myself?","
How do I find a VA for $1.50
FreeeUp requires minimum of $5
and I’ve some people apply to my listing on OnlineJobs.ph, but most of them want higher pay
Also OnlineJobs.ph has monthly fee. Once I hire, do I cancel the onlinejobs account and pay the VA myself?
"
14,VA workload,Human Resources,Human Resources,twentyfoursevenagent,I’m about to hire my first VA and want to know how much workload is ideal for him. I plan to delegate 100% of our sourcing activities to him but don’t know how much more I should expect from a fulltime VA.  I’d love to hear your recommendations.  Thanks.,"
I’m about to hire my first VA and want to know how much workload is ideal for him. I plan to delegate 100% of our sourcing activities to him but don’t know how much more I should expect from a fulltime VA.
I’d love to hear your recommendations.
Thanks.
"
15,VAs Using Tools,Human Resources,Human Resources,angie,"Hi All!  How do ya’ll give your VA’s access to your software tools? I gave my VA’s my developer ID’s and MWS token, but they were unable to get access.","
Hi All!
How do ya’ll give your VA’s access to your software tools? I gave my VA’s my developer ID’s and MWS token, but they were unable to get access.
"
16,When to stop accepting applicants,Human Resources,Human Resources,mshayanh13,"In one of the WEBS templates, it says  Close position once you have enough applicants (usually 50+)  Is it 50 applicants who are under the $3 range or 50 total?  Also, those that are asking for more than $3 an hour, should we just ignore those applications or let them know what our rate is? Maybe they were asking for higher price to see if they could get it but were willing to work for less.","
In one of the WEBS templates, it says
Close position once you have enough applicants (usually 50+)
Is it 50 applicants who are under the $3 range or 50 total?
Also, those that are asking for more than $3 an hour, should we just ignore those applications or let them know what our rate is? Maybe they were asking for higher price to see if they could get it but were willing to work for less.
"
17,VAs and the number of Prime sellers,Human Resources,Human Resources,MBahe,"One of our trial VAs is proving to be quite a rockstar. He figured out that the number of Prime sellers he saw only matched our data if he logged in using his VPN with a US address.    Is that how most people do it?  Thanks in advance,  Matt","
One of our trial VAs is proving to be quite a rockstar. He figured out that the number of Prime sellers he saw only matched our data if he logged in using his VPN with a US address.

Is that how most people do it?
Thanks in advance,
Matt
"
18,Hiring first VA,Human Resources,Human Resources,twentyfoursevenagent,I’m working on hiring my first VA and now working on creating a task for qualified applicants. I have a few questions on which SOPs they’re exactly supposed to follow & work on. The HR SOP “Creating Tasks” only talks about assigning and creating a Product Extraction Flowster workflow but does not elaborate which ones should be done by the VA applicant. Below are my questions:    Is this SOP just talking about making VA do numbers <#8 Extract the Full List of Products> and <#9 Filter Data in Exce...,"
I’m working on hiring my first VA and now working on creating a task for qualified applicants. I have a few questions on which SOPs they’re exactly supposed to follow & work on. The HR SOP “Creating Tasks” only talks about assigning and creating a Product Extraction Flowster workflow but does not elaborate which ones should be done by the VA applicant. Below are my questions:


Is this SOP just talking about making VA do numbers <#8 Extract the Full List of Products> and <#9 Filter Data in Excel> only?


There’s no mention that I should add the VA applicants to my Snovio, Jungle Scout, RevSeller and Hubspot accounts but all of those are necessary in following the ""Product Extraction using PC2 SOP. So should I add them?


"
19,VAs using your emails?,Human Resources,Human Resources,Thomas1985,How do you guys arrange your e-mail addresses with Hubspot?  Do you use more than one e-mail address?  I’m thinking of using contact@company.com to send them all out and wait for replies and then forward responses to one of our personal emails like Diana@company.com.  Am I making it too complicated?  Should they just use one?  Should it be the same one Jungle Scout and Keepa are associated with so a VA can use my subscriptions?  Seems pretty trusting on my part to let someone sign into my main e...,"
How do you guys arrange your e-mail addresses with Hubspot?  Do you use more than one e-mail address?  I’m thinking of using contact@company.com to send them all out and wait for replies and then forward responses to one of our personal emails like Diana@company.com.  Am I making it too complicated?  Should they just use one?  Should it be the same one Jungle Scout and Keepa are associated with so a VA can use my subscriptions?  Seems pretty trusting on my part to let someone sign into my main e-mail address.
"
20,Where have you found your best hires?,Human Resources,Human Resources,LizD,"We like to use onlinejobs.ph for Virtual Assistant hires.  When hiring locally, we first ask current employees and friends, and post on FB. When word of mouth fails us, we’ve had the best luck with Indeed.com. Any other places you’ve found good people?","
We like to use onlinejobs.ph for Virtual Assistant hires.
When hiring locally, we first ask current employees and friends, and post on FB. When word of mouth fails us, we’ve had the best luck with Indeed.com. Any other places you’ve found good people?
"
21,About the Amazon Specific Category,Amazon Specific,Amazon Specific,Trent-Admin,Have questions about using the Amazon marketplace? This is the category to use. Please be sure to select the most appropriate sub-category for your questions.,"
Have questions about using the Amazon marketplace? This is the category to use. Please be sure to select the most appropriate sub-category for your questions.
"
22,Getting positive reviews,Amazon Specific,Amazon Specific,D.Jin,"Hi,  Is there any amazon compliant manner of getting positive reviews for your listing?  Cheers,  David","
Hi,
Is there any amazon compliant manner of getting positive reviews for your listing?
Cheers,
David
"
23,How Can I Increase My Amazon Conversion Rate,Amazon Specific,Amazon Specific,chcsteele9,How Can I Increase My Amazon Conversion Rate?,"
How Can I Increase My Amazon Conversion Rate?
"
24,Reviews wiped out,Amazon Specific,Amazon Specific,liahsidney,Any one familiar with reviews wiped out? Is there a way to detect or be notified if the reviews significantly decrease over a short period? Thanks.,"
Any one familiar with reviews wiped out? Is there a way to detect or be notified if the reviews significantly decrease over a short period? Thanks.
"
25,Request a review,Amazon Specific,Amazon Specific,liahsidney,"Anyone encountered the new feature in the manage orders ""request a review?","
Anyone encountered the new feature in the manage orders ""request a review?
"
26,Vintage watch,Amazon Specific,Amazon Specific,ClarkAtti,Hi! I have some used vintage watches. Can i sell it on amazon? Thanks.,"
Hi! I have some used vintage watches. Can i sell it on amazon? Thanks.
"
27,How to reduce ACOS?,Amazon Specific,Amazon Specific,jims,My ACOS is around 70% right now. Which is pretty bad for my profit margin.  Any tips on how to get it lower?,"
My ACOS is around 70% right now. Which is pretty bad for my profit margin.
Any tips on how to get it lower?
"
28,Amazon Limiting FBA Inbound Shipments,Amazon Specific,Amazon Specific,Mitch,"As I’m sure you all have heard from Amazon, they are limiting products that can be sent into their warehouses to “essentials” until April 5th.  For now, I am just planning on trying to build a shipment before I reorder products.  Does anyone know of a better way to find out which of the products in your inventory can be sent in during these messy times?","
As I’m sure you all have heard from Amazon, they are limiting products that can be sent into their warehouses to “essentials” until April 5th.  For now, I am just planning on trying to build a shipment before I reorder products.
Does anyone know of a better way to find out which of the products in your inventory can be sent in during these messy times?
"
29,How can i open the category on amazon?,Amazon Specific,Amazon Specific,Khan,"How can i open the category on amazon? I want to ungate toys and grocery, medecine. What should i do?","
How can i open the category on amazon? I want to ungate toys and grocery, medecine. What should i do?
"
30,Report that shows $ for returned items?,Amazon Specific,Amazon Specific,randy1,We’re trying to find a report that shows the value of returned items between two dates.  Does anyone know where this is located?,"
We’re trying to find a report that shows the value of returned items between two dates.
Does anyone know where this is located?
"
31,Received email that said ODR is > 1%,Amazon Specific,Amazon Specific,zaid,"We just received an email this morning that said our ODR is greater than 1%, but it’s not even close.  I’m hoping this is just a bug in Amazon’s system or something.  Has anyone else received such an email or heard of this happening?","
We just received an email this morning that said our ODR is greater than 1%, but it’s not even close.
I’m hoping this is just a bug in Amazon’s system or something.
Has anyone else received such an email or heard of this happening?
"
32,Tax interview for non US citizen with US LLC,Amazon Specific,Amazon Specific,watson,"Hoping someone may know the answer here…  I’m a non US citizen with a US LLC. Currently i’m selling under my own name because in the tax interview it says for single member LLCs, put your own personal name.  However, of course i’d much rather be registered under my LLC name and address.  And if i have a US registered LLC, surely that is a business and US entity that is subject to US taxes?  When i enter “business” rather than “individual” on the form instead and say i’m a US person for tax reaso...","
Hoping someone may know the answer here…
I’m a non US citizen with a US LLC. Currently i’m selling under my own name because in the tax interview it says for single member LLCs, put your own personal name.
However, of course i’d much rather be registered under my LLC name and address.
And if i have a US registered LLC, surely that is a business and US entity that is subject to US taxes?
When i enter “business” rather than “individual” on the form instead and say i’m a US person for tax reasons, it asks what kind of LLC - C-Corp, S-Corp or Partnership, then i can enter my EIN number (My LLC is just a simple single member LLC, no mention of any C-Corp or S-Corp)
Anyone also have an issue with this?  Don’t want to get anything wrong!
Really appreciate any feedback
"
33,Seller Legend: compare month-over-month data,Amazon Specific,Amazon Specific,Blue,"We’ve recently begun using Seller Legend and can already see its potential.  Does anyone know how to compare month-over-month sales data, though?","
We’ve recently begun using Seller Legend and can already see its potential.
Does anyone know how to compare month-over-month sales data, though?
"
34,"Just got approved for ""dangerous goods"" but can't switch to FBA",Amazon Specific,Amazon Specific,randy1,"We recently filled out the Dangerous Goods exemption form and got approved for Not Hazardous.  However, we then tried changing the shipment from merchant-fulfilled to FBA, but are again asked to fill out the Dangerous Goods form. This is very odd 🧐  Has anyone ran into this before?","
We recently filled out the Dangerous Goods exemption form and got approved for Not Hazardous.
However, we then tried changing the shipment from merchant-fulfilled to FBA, but are again asked to fill out the Dangerous Goods form. This is very odd 
Has anyone ran into this before?
"
35,FBA inventory storage fee breakdown,Amazon Specific,Amazon Specific,randy1,Hey guys!  I’m looking for a report that shows FBA storage fees that we get charged. Specifically I want to see it broken down by unit. Does something like this exist?  Thank you very much.,"
Hey guys!
I’m looking for a report that shows FBA storage fees that we get charged. Specifically I want to see it broken down by unit. Does something like this exist?
Thank you very much.
"
36,Choosing a niche for selling on Amazon,Amazon Specific,Amazon Specific,almoodie,"Trent recommends choosing a niche category for selling Wholesale on Amazon. How important is this.  Here’s the list of categories I have narrowed it down to:  Automotive & Powersports  Camera & Photo  Consumer Electronics  Grocery & Gourmet Foods  Health & Personal Care  Industrial & Scientific  Office Products  Personal Computers  Software  Sports  Tools & Home Improvement  I’m hung up here, any input appreciated.","
Trent recommends choosing a niche category for selling Wholesale on Amazon. How important is this.
Here’s the list of categories I have narrowed it down to:
Automotive & Powersports
Camera & Photo
Consumer Electronics
Grocery & Gourmet Foods
Health & Personal Care
Industrial & Scientific
Office Products
Personal Computers
Software
Sports
Tools & Home Improvement
I’m hung up here, any input appreciated.
"
37,Thoughts on chasing price,Amazon Specific,Amazon Specific,BobG,"Hi there,  I have a new wholesale product that has had two FBA sellers on it for what looks like a while.  Now I show up with my inventory and list slight higher than the lowest seller and he appears to have a repricer that immediately drops his price.  I once again go down to just slight above his price and he goes down again… I do seem to have found his floor but my question is this, would you wait for him to sell through his inventory or follow him down to get a portion of the buy box.  Of co...","
Hi there,
I have a new wholesale product that has had two FBA sellers on it for what looks like a while.  Now I show up with my inventory and list slight higher than the lowest seller and he appears to have a repricer that immediately drops his price.  I once again go down to just slight above his price and he goes down again… I do seem to have found his floor but my question is this, would you wait for him to sell through his inventory or follow him down to get a portion of the buy box.  Of course he can always replenish.  Any thoughts?  I
"
38,Share reorder process,Amazon Specific,Amazon Specific,MaRa,"Hi,  Anyone can share the reorder process?  Do you reorder each day by the recommendation of tool?  Or you have a weekly process?  How to track all the shipments?  How to automate this process?  Thanks","
Hi,
Anyone can share the reorder process?
Do you reorder each day by the recommendation of tool?
Or you have a weekly process?
How to track all the shipments?
How to automate this process?
Thanks
"
39,Add a new product to a sponsored ad campaign?,Amazon Specific,Amazon Specific,randy1,I’m struggling trying to add a new product to an existing campaign. It doesn’t seem intuitive at all.  Does anyone know how? Thank you!,"
I’m struggling trying to add a new product to an existing campaign. It doesn’t seem intuitive at all.
Does anyone know how? Thank you!
"
40,iPhone 11 won't scan UPC codes properly?,Amazon Specific,Amazon Specific,jims,"I recently upgraded my phone, and now I’m having a lot of difficulty scanning UPC codes. Basically 10% of them work properly. I’ve tried changing lighting, angles, but nothing seems to help for those codes that won’t scan.  Has anyone else noticed this?","
I recently upgraded my phone, and now I’m having a lot of difficulty scanning UPC codes. Basically 10% of them work properly. I’ve tried changing lighting, angles, but nothing seems to help for those codes that won’t scan.
Has anyone else noticed this?
"
