,Topic Title,Category,Tags,Authors,Leading Comment,Other Comments
0,About the Human Resources category,Human Resources,['Human Resources'],['Kane'],Have questions about Human Resources? This is the category to use. Please be sure to select the most appropriate sub-category for your questions.,['Have questions about Human Resources? This is the category to use. Please be sure to select the most appropriate sub-category for your questions.']
1,VA using PC2 & Revseller,Human Resources,['Human Resources'],"['twentyfoursevenagent', 'Trent-Admin', 'edsutton', 'twentyfoursevenagent', 'Kerry_CyberShelf']",My VA reported not having the Amazon Browser in his PC2. He downloaded the paid software  & is using a US address VPN. He entered the correct MWS and Seller ID but still cant get it to work.  Does he have to be actually signed in my Amazon Seller account when setting up PC2?  Also considering subscribing to Revseller too. It seems that I also have to be logged in my Seller Central account for it to show brand restrictions. Any suggestions?,"['My VA reported not having the Amazon Browser in his PC2. He downloaded the paid software  & is using a US address VPN. He entered the correct MWS and Seller ID but still cant get it to work.\nDoes he have to be actually signed in my Amazon Seller account when setting up PC2?\nAlso considering subscribing to Revseller too. It seems that I also have to be logged in my Seller Central account for it to show brand restrictions. Any suggestions?', 'I would suggest you reach out to PC2 support.', 'Try Seller Central coaching https://sellercentral.amazon.com/gp/help/help.html/?itemID=G201642900&ref_=xx_G201642900_a_r2_cont_sgsearch\nhttps://sellercentral.amazon.com/learn/courses?ref_=selleru_athena_c17_m79&courseId=17&moduleId=79&modLanguage=English&contentType=VIDEO&videoPlayer=youtube\nI would consider that you might need to get the VA’s name and contact info and email,  and under permissions - name the VA and email him an invitation, and set his permissions .   Then the VA would need to be recognized by Amazon if the software requires being in the system .  You can request an Amazon coach to send walk you through directions and advise you.\nIt could be a PC2 problem, or an Amazon problem, or a problem of lack of link up and or lack of permissions.', 'Thanks for the tip guys!', 'Hi @twentyfoursevenagent - I am new to the forum and your teething issues last year are similar to mine that are happening now. Do you mind me asking -  is your Product Extraction workflow process using PC2 working just fine? I downloaded the free version and it doesn’t have the button that says ‘Amazon Browser/Searches’. Do I need to purchase the full PC2 package?\nI want to go through the whole process first before I get a VA onboard. Thanks for your help in advance!']"
2,Training a VA to find brand contact information,Human Resources,['Human Resources'],"['Cameron.B', 'Mitch', 'Cameron.B', 'Cameron.B', 'Mitch']","Hello everyone, I’m having trouble helping to train my VA to find the contact information for brands. My linkedin profile has fifty+ connections, but when doing some brand contact research with my VA we both have been running into blocked pages of people. Keep in mind this is with a LinkedIn premium business account, although it’s still the first free month.  I’m wondering if the first free month actually has all the same capability as when I actually start paying next month, but maybe not?  Als...","['Hello everyone, I’m having trouble helping to train my VA to find the contact information for brands. My linkedin profile has fifty+ connections, but when doing some brand contact research with my VA we both have been running into blocked pages of people. Keep in mind this is with a LinkedIn premium business account, although it’s still the first free month.\nI’m wondering if the first free month actually has all the same capability as when I actually start paying next month, but maybe not?\nAlso, when showing my VA how to find the company website, using that to find their linkedin page, to then use snov.io to find contact information on their company page. What else can I do to help train my VA? I was thinking of just showing her more examples of how I do the research, but maybe there is something else I can get to reveal information about businesses I will be reaching out to?\nI know the TWF guys have talked about being able to buy access to business information for each state? Does anyone remember what that’s called? Is it available through the chamber of commerce of each state?', '@Cameron.B Hopefully when you actually start paying you won’t be limited anymore.\nOne thing we do for more complex tasks is shoot videos using Loom.  That way they can refer back to you walking through the task whenever they need it.', 'I have camtasia to record my screen. I’m definitely planning on recording doing product research.\nYou know I think I’ll contact LinkedIn to see what’s up.', 'I found out that you will always be limited to third degree search for paid Linkedin accounts, except for one.\nIt’s called a sales navigator account. This account will let you view profiles way outside your range, but it will only let you do this 25 times per month.\nI’ve also been looking into this company called zoominfo.com I can see they have contact information for just about all the people I want to reach.\nThere is also another company like this called globaldatabase.com', '@Cameron.B Thank you for sharing these other sites!']"
3,Performance reviews for Virtual Assistants?,Human Resources,"['Human Resources', 'Performance Reviews']","['jims', 'Mitch']","Does anyone do this? I’ve considered it, but wasn’t sure if it was normal or not.","['Does anyone do this? I’ve considered it, but wasn’t sure if it was normal or not.', '@jims Absolutely!  It is important to have some baseline of what you expect from a VA and monitor to make sure they are meeting standards.']"
4,Best job sites for virtual assistants?,Human Resources,"['Human Resources', 'Recruiting']","['Blue', 'jims']","Where does everyone find their VAs? I’ve used onlinejobs.ph and upwork.com in the past, but was curious if there’s better options nowadays?","['Where does everyone find their VAs? I’ve used onlinejobs.ph and upwork.com in the past, but was curious if there’s better options nowadays?', 'I’ve recently been using goLance and it’s been great! The fees are much better than UpWork too.']"
5,Domestic vs Filipino VAs,Human Resources,"['Human Resources', 'Outsourcing']","['dast1983', 'LizD', 'EBF', 'dast1983', 'EBF']","Hey everyone -  Need your opinion and experience on outsourcing with domestic vs Filipino VAs. I need someone to contact suppliers and scane Excel spreadsheets and estimate quantities to order for my Amazon business. Currently, I pay a domestic VA $25/hr to do this, and she’s okay. She’s got a great attitude, but doesn’t source a lot of profitable product, unless I hand suppliers her way. This is a fairly complex analytical task…  Do you think I can outsource this to Filipinos and have success…o...","['Hey everyone -\nNeed your opinion and experience on outsourcing with domestic vs Filipino VAs. I need someone to contact suppliers and scane Excel spreadsheets and estimate quantities to order for my Amazon business. Currently, I pay a domestic VA $25/hr to do this, and she’s okay. She’s got a great attitude, but doesn’t source a lot of profitable product, unless I hand suppliers her way. This is a fairly complex analytical task…\nDo you think I can outsource this to Filipinos and have success…or is it a higher paid ($20+ per hour) work to outsource to domestic VAs?\nThanks for your opinions!\nDan', 'If it’s something that you can create an effective yes/no procedure for, I think you can find a Filipino VA who has some math/accounting skills to do so effectively… either way, I’d say it’s worth a try as you’re paying >5x what you’d pay someone in the Philippines…', 'With a good VA  , you can have this done for $3 to $5 per hour. Just need to interview and sort through them (Like you would here), and give them an excellent SOP , then no reason to be paying $25 per hour.   Including finding supppliers. I use Filipino VA;s for everything except phoning US customers and initial calls to develop a supplier relationship', 'How do you find your VAs? I use FreeEup.com and they keep sending more expensive ones.', 'OnLineJobs.p']"
6,Budgeting for virtual assistants,Human Resources,"['Human Resources', 'Recruiting']","['MWC1', 'Mitch', 'MWC1', 'Mitch']",Doing budgeting for the upcoming year looking to hire four virtual assistants out of the Philippines. What would be a good hourly labor rate to budget?,"['Doing budgeting for the upcoming year looking to hire four virtual assistants out of the Philippines. What would be a good hourly labor rate to budget?', '@MWC1 We typically budget for $3/hour.', 'Mitch,\nThanks for reaching out to me. I was guessing somewhere in that neighborhood but it’s nice to have confirmation.\nthank you', '@MWC1 You betcha!']"
7,What email should be used for VA software use?,Human Resources,"['Human Resources', 'Managing a Virtual Team']","['WillCompere', 'Mitch', 'WillCompere', 'Mitch']",Does it matter what email you have linked to the software your VAs use? Would it be wise to use a specific software use email for these tasks? like: research@insert website name  This may be negligible and might not matter but part of me thinks to have separate emails used for different tasks in your business could help at separating and delegating out things. Thanks in advance 🙂,"['Does it matter what email you have linked to the software your VAs use? Would it be wise to use a specific software use email for these tasks? like: research@insert website name\nThis may be negligible and might not matter but part of me thinks to have separate emails used for different tasks in your business could help at separating and delegating out things. Thanks in advance', '@WillCompere It depends on how much you are using free versions of software.  In particular with email lead finding tools, if you are using free versions you will have short limits placed on usage.  In this case, you will certainly want each VA using their own email.\nIf you are paying for most of your software and don’t have limits, then one email will work fine and  make managing software usernames and passwords easier.', 'So using my personal website email as the login for my software is preferable? Also gives more security in case for whatever reason they try to change the password or do something shady, my email would get hit with a notification about it', '@WillCompere Ya so for your paid accounts, consider using the same personal website email.  For unpaid accounts, VAs can just use their own emails.']"
8,VA-How Would I Locate a VA to enter listings into Amazon & E-bay,Human Resources,"['Human Resources', 'Managing a Virtual Team']","['Bill', 'Laura', 'twentyfoursevenagent', 'PLWSeller', 'Bill', 'PLWSeller', 'PLWSeller', 'uncleusa', 'uncleusa', 'uncleusa']","Good morning to all,  I am new to this forum.  I realize that a weakness of mine is entering listings in Amazon & E-bay. It takes forever & I am not good at it. I would like to enter several “regular/normal” listings as well as listings where I bundle several products together.  What would be the best practice for finding help with this either in the United States or out of the United States?  Thanks to all!  Bill","['Good morning to all,\nI am new to this forum.\nI realize that a weakness of mine is entering listings in Amazon & E-bay. It takes forever & I am not good at it. I would like to enter several “regular/normal” listings as well as listings where I bundle several products together.\nWhat would be the best practice for finding help with this either in the United States or out of the United States?\nThanks to all!\nBill', 'Hi @Bill PURCHASING: New Product Step 1: Pre & Post PO Actions SOP  has steps  that show you how to add a listing to Amazon, if you need to create an Amazon listing you can use PRODUCT LISTING: How to Create a Variation With (and Without) an Upload Doc to walk you through the process.\nYou can always assign these steps to your sourcing VA to help. When we hire a VA we commonly have them do tasks that are not only sourcing tasks.', 'Amy Wees has a FB group that has a lot of free info about product listings. I’m a member of the group and find it very helpful.', 'I know of several VAs looking for work if you are interested.', 'I am interested, can we talk?', 'Not sure how to connect other than provide an email address.', 'bollcnv at gmail', 'I need Trained VA and my email is UNCLEUSA  at Gmail\nthanks\nShawn Chhabra', 'Bill I need Trained VA and my email is UNCLEUSA  at Gmail\nthanks\nShawn Chhabra', 'hi;\nI need Trained VA and my email is UNCLEUSA  at Gmail\nthanks\nShawn Chhabra\nhttps://www.linkedin.com/in/shawnchhabrausa']"
9,When to use VAs vs employees?,Human Resources,['Human Resources'],"['dast1983', 'Mitch', 'dast1983', 'Ben', 'dast1983', 'Ben', 'Mitch']","Hi -  So I’m ready to bring on my second regular VA. I’ve made up my mind that VAs, in general, will work best to take care of many gruntwork, time-consuming tasks.  However, this VA will do an important task - sourcing. For now, I can’t afford an employee. So, I’m going to use a VA to at least tide me over until I get closer to that point.  But, by early-to-mid next year, I have a good shot at being able to afford an employee. And then I see some people in this forum use VAs full-time to do sou...","['Hi -\nSo I’m ready to bring on my second regular VA. I’ve made up my mind that VAs, in general, will work best to take care of many gruntwork, time-consuming tasks.\nHowever, this VA will do an important task - sourcing. For now, I can’t afford an employee. So, I’m going to use a VA to at least tide me over until I get closer to that point.\nBut, by early-to-mid next year, I have a good shot at being able to afford an employee. And then I see some people in this forum use VAs full-time to do sourcing.\nSo, when I can afford an employee to do sourcing, how do I decide to go with an employee or with a VA instead?\nThanks,\nDan', '@dast1983 This depends on what type of sourcing tasks you want the employee to do. If you want someone to do sourcing steps 1-3, a VA can manage this. If you want someone to validate products and communicate with potential suppliers, this is where you need an employee.', 'Thanks Mitch. I don’t have WEBS, so what are steps 1-3? What do you mean by “validating products?”', 'Dan\nMy experience has been that with a good VA they can do a large majority of the work.  Our best VA can run almost every aspect of our business other than closing a deal.  He could probably do that also if his English was a little better.  With proper training and tools you can really leverage your VAs.    The primary reason to hire a US based employee for us is a  “sales person”  that can be your closer.', 'Ok. Thanks Ben. What makes you keep a VA to do full-time work? They can just leave at the snap of a finger, which makes me a little nervous.', 'Dan\nI am not sure I fully understand the question and/or concern.  Any employee could leave at any time.   We treat our VA’s like we would any other US based employee.  Treat them well and dont give them a reason to leave.  Having strong SOPs and tools in place allows you to plug people into roles if you do have a change in staffing…', 'Steps 1-3 are the WEBS processes that we use. This includes finding storefronts and extracting brands and products from those storefronts. This is the ground work that we have all VAs do. After we receive a price list, we revaluate products to make sure that they are as profitable as we thought at the price point (validating products after the VA finds them).']"
10,Best va practices,Human Resources,"['Human Resources', 'Managing a Virtual Team']","['Brandon_Bouchereau', 'Laura', 'Brandon_Bouchereau', 'Laura', 'Brandon_Bouchereau', 'Brandon_Bouchereau', 'Laura', 'Laura', 'Brandon_Bouchereau', 'Laura', 'Brandon_Bouchereau', 'Brandon_Bouchereau', 'Laura', 'gianmeliShanghai', 'Kathy', 'Mitch']",Should we have a VA to only to compile brands and then 1 to do the extraction or depends on the ability of the  VA ? I assume that will be the answer but what is best practice?,"['Should we have a VA to only to compile brands and then 1 to do the extraction or depends on the ability of the  VA ? I assume that will be the answer but what is best practice?', 'I think it depends on the strengths of your VAs. We typically have one find competitors, then every VA will do Product Extractions around other tasks.', 'Thank you. Also, at one point do we do product extraction? Once I get like 1000 companies on a list  or is there a base line number to generally look at then do hire for extraction ?', '@Brandon_Bouchereau a Product Extraction is done for each competitor that you find on amazon (so a competitor storefront)–and not per brand. If you are looking to do an extraction process per brand you would follow the Brand sourcing procedures.', 'I’m sorry that’s what I meant', 'What I meant to ask is we send the 300 emails per week to potential storefronts  we want to source product from. However, in order to send that many emails to different brands we need to find like 1000 storefront brands …are you understanding what I’m trying to ask? I feel like I may be confused about difference btw storefront brand and product brand', 'I see! Unfortunately there is no rule of thumb number. This varies greatly by the filters you use when extracting, the number of products a competitor has, the category the competitor is in, etc. Sometimes a Product Extraction can produce 100 leads or 0 leads. It is pretty impossible to pick a generic number.\nWe communicate with our VAs on how many emails we want to send that week, and it is up to them to make sure we consistently have that number of leads in Hubspot for contact.', 'A storefront is not a brand, a storefront is a list of products that a competitor on Amazon sells. A product brand is the brand that manufactured the product. For example: Seller A sells Colgate Toothpaste. The Storefront would be “Seller A’s” storefront, the product brand would be “Colgate”. Hope that helps!', 'Yes I understand . Just to be clear if storefront A has a product I want to source . That lead name goes towards my 300 emails per week to send to…correct ?', 'Seller A’s Storefront has a product you want to source. To source this you would enter Seller A into the competitor tracking document, a VA would use PC2 to extract all of Seller A’s products, this would create a Product Extraction spreadsheet. This Product Extraction spreadsheet holds all of the products and brands that Seller A sells on Amazon. The products that work for you get imported to Hubspot, then you contact the brands of those products.', 'Gotcha ! Thanks for clarification and prompt response', 'How do I give permission for my VA to run price checker 2? I gave permission for my seller central account but my VA still cant enter . Need some help @Laura', '@Brandon_Bouchereau PC2’s website has a direct help video to show how to download and use PC2 (so does Leaf Sourcing step 2).\nYou will need to give your VA your PC2 credentials (which will be separate from your Amazon Seller Central credentials).\nOnce you add a user to your Amazon Seller Central account, you need to go back and change their permissions. This is shown in the AMAZON: How to Edit Permissions in Seller Central.\nFor more specific questions you can always email support@brightideas.co', 'How many people/VAs do you estimate to have in order to reach the target you guys recommend of 300 emails per week?', 'I’m hiring a VA in the next week or two.  I had 3 last year, and it just did not go well.  I’m sure it was something I did.  But, is laziness my fault?  Probably.  It is difficult for me to know if I have the right person.  The next VA is being trained by another VA for someone else.  I’m looking forward to see how this works out.', 'That depends on the number of hours they work, and the other tasks they are assigned. We currently have 4 VAs.']"
11,VAs familiar with WEBS?,Human Resources,"['Human Resources', 'Managing a Virtual Team']","['gianmeliShanghai', 'LizD']","Hello, can anyone suggest good VAs that are also familiar with WEBS sops?  Can WEBS team provide any?  What is the average hourly rate for these people?  Thank you","['Hello, can anyone suggest good VAs that are also familiar with WEBS sops?\nCan WEBS team provide any?\nWhat is the average hourly rate for these people?\nThank you', 'You will occasionally find people in the forum who need to let VAs go.\nWe’ve found that with the SOPs as they are, there is only marginal value to finding a pre-trained VA. We usually find them on onlinejobs.ph. They often start a little lower but after a couple of months we like to ensure we’re paying $3/hr.']"
12,Letting go of a VA,Human Resources,"['Human Resources', 'Managing a Virtual Team']","['steph', 'LizD', 'steph']",What is “best practice” when letting go of a VA? Notice and pay?,"['What is “best practice” when letting go of a VA? Notice and pay?', 'Steph, we have an SOP for letting a VA go. It’s kind of up to you on notice and pay… if they’ve been great and you can afford it it’s nice to give them some sort of severance and notice. I’m thinking a week notice and an additional one of severance would be nice.', 'Hi Liz.\nHope all is well!\nThank you for the feedback.\nI will check out the SOP.']"
13,Getting a VA for 1.50,Human Resources,"['Human Resources', 'Managing a Virtual Team']","['mshayanh13', 'Laura', 'LizD', 'mshayanh13', 'twentyfoursevenagent', 'terrifetters', 'Laura', 'KeithH', 'mshayanh13', 'Laura']","How do I find a VA for $1.50  FreeeUp requires minimum of $5  and I’ve some people apply to my listing on OnlineJobs.ph, but most of them want higher pay  Also OnlineJobs.ph has monthly fee. Once I hire, do I cancel the onlinejobs account and pay the VA myself?","['How do I find a VA for $1.50\nFreeeUp requires minimum of $5\nand I’ve some people apply to my listing on OnlineJobs.ph, but most of them want higher pay\nAlso OnlineJobs.ph has monthly fee. Once I hire, do I cancel the onlinejobs account and pay the VA myself?', '@LizD Might have a good response for this.', 'We have found very few VAs willing to work for $1.50/hr… we usually start them at $2 and up.\nIn our job posting, we ask them for their expected rate of pay. That makes it easy to weed out anyone who expects too much.\nBut honestly, our goal is to have them all at $3+/hr after 6 months (because if they’re good enough, they’re worth that… and we want them to stay).\nWe find them all on onlinejobs.ph… we pay the monthly fee and cancel our account before 30 days is up. Therefore we’re only paying for 1 month of the subscription. We find we can hire within 30 days.', 'What platform do you use to pay them?\nOn PayPal I noticed there was fee when transferring money to their accounts.', 'I use Paypal. I reimburse them the Paypal fees on their next payday.', 'Has anyone used Been to pay their VA’s? Any feedback on it’s comparison to PayPal?', 'We use Veem', 'We used a combination of paypal and upwork for processing payments but have moved everyone to transferwise to ensure they get as much as we are paying them as possible. It also hooks into hubstaff so the payments are automatic just as if we were using upwork.\nEdit: I want to mention that we we only move them off the tracking and payment platform we hired them on after working with them for a while.', 'As a beginner, I understand sourcing is most important, and a VA should do it. Should she/he work on all 5 sourcing steps or just steps 2 and 3? As of right now my VA is part time (1.50 an hour). I might turn her into full time if I find a really good account.', '@mshayanh13 Not all sourcing steps are fit for a VA. In the overview on the templates there is a bio with who should complete the SOP. If you are only having one VA work, and at that level I would recommend that your VA only work on step 2 and you complete the others. At least until your VA learns the system or you have more VAs.']"
